,influencer,title,author,subtitle,id_code,identifier_type,ISBN
2955,Sam Altman,Plan B 3.0,Lester R. Brown,Mobilizing to Save Civilization,0393065898,ISBN,0393065898
2956,Sam Altman,Man's Search for Meaning,Viktor E. Frankl,,https://www.amazon.com/dp/0807014273?tag=danpink.com-recommendedbooks-20,ISBN,
2957,Sam Altman,Pandaemonium,Humphrey Jennings,The Coming of the Machine as Seen by Contemporary Observers,B00KFEJKTS,ASIN,
2958,Sam Altman,"Thinking, Fast and Slow",Daniel Kahneman,,0374533555,ISBN,0374533555
2959,Sam Altman,The Principia,Isaac Newton,The Authoritative Translation and Guide: Mathematical Principles of Natural Philosophy,0520290887,ISBN,0520290887
2960,Sam Altman,Powering the Future,Robert B. Laughlin,How We Will (Eventually) Solve the Energy Crisis and Fuel the Civilization of Tomorrow,B005I58OMS,ASIN,
2961,Sam Altman,"Hateship, Friendship, Courtship, Loveship, Marriage",Alice Munro,Stories,0375727434,ISBN,0375727434
2962,Sam Altman,The Constitutional Convention,James Madison,A Narrative History from the Notes of James Madison,0812975170,ISBN,0812975170
2963,Sam Altman,The Score Takes Care of Itself,Bill Walsh,My Philosophy of Leadership,1591843472,ISBN,1591843472
2964,Sam Altman,Dealers of Lightning,Michael A. Hiltzik,Xerox PARC and the Dawn of the Computer Age,0887308910,ISBN,0887308910
2965,Sam Altman,The Republic,Plato,,1534626913,ISBN,1534626913
2966,Sam Altman,The Trial of Socrates,I. F. Stone,,0385260326,ISBN,0385260326
2967,Sam Altman,The Origin of Consciousness in the Breakdown of the Bicameral Mind,Julian Jaynes,,0618057072,ISBN,0618057072
2968,Sam Altman,Hunger of Memory,Richard Rodriguez,The Education of Richard Rodriguez,B000FC0Y04,ASIN,
2969,Sam Altman,Anna Karenina,Leo Tolstoy,,0143035002,ISBN,0143035002
2970,Sam Altman,Fundamentals of Plasma Physics,Paul M. Bellan,,0521528003,ISBN,0521528003
2971,Sam Altman,Einstein,Walter Isaacson,His Life and Universe,0743264746,ISBN,0743264746
2972,Sam Altman,The Legend of Henry Ford,Keith Sward,,B000NSOP7S,ASIN,
2973,Sam Altman,Zero to One,Peter Thiel,"Notes on Startups, or How to Build the Future",0804139296,ISBN,0804139296
2974,Sam Altman,The Fall,Albert Camus,,0679720227,ISBN,0679720227
2975,Sam Altman,A Heartbreaking Work of Staggering Genius,Dave Eggers,,0375725784,ISBN,0375725784
2976,Sam Altman,Brave New World,Aldous Huxley,,0060850523,ISBN,0060850523
2977,Sam Altman,The Kite Runner,Khaled Hosseini,,1594481776,ISBN,1594481776
2978,Sam Altman,Call Me by Your Name,AndrÃ© Aciman,A Novel,1250169445,ISBN,1250169445
2979,Sam Altman,The Picture of Dorian Gray,Oscar Wilde,,0486278077,ISBN,0486278077
2980,Sam Altman,The Making of a Manager,Julie Zhuo,What to Do When Everyone Looks to You,https://www.amazon.com/dp/0735219567?tag=danpink.com-recommendedbooks-20,ISBN,
2981,Ray Dalio,The Undoing Project,Michael Lewis,A Friendship That Changed Our Minds,B01GI6S7EK,ASIN,
2982,Ray Dalio,The Lessons of History,Will & Ariel Durant,,143914995X,ISBN,143914995X
2983,Ray Dalio,Changing Minds,Howard Gardner,The Art and Science of Changing Our Own and Other Peoples Minds,B00THMKOPS,ASIN,
2984,Ray Dalio,Endurance,Alfred Lansing,Shackleton's Incredible Voyage,753277323X,ISBN,753277323X
2985,Ray Dalio,Destined for War,Graham Allison,Can America and China Escape Thucydides's Trap?,B01IAS9FZY,ASIN,
2986,Ray Dalio,Discovering Your Personality Type,Don Richard Riso,The Essential Introduction to the Enneagram,B004MYFLAE,ASIN,
2987,Ray Dalio,Who am I?,Steven Reiss,16 Basic Desires that Motivate Our Actions Define Our Personalities,B000OCXHQS,ASIN,
2988,Ray Dalio,Originals,Adam Grant,How Non-Conformists Move the World,014312885X,ISBN,014312885X
2989,Ray Dalio,The Hero with a Thousand Faces,Joseph Campbell,,9382742611,ISBN,9382742611
2990,Ray Dalio,"Thinking, Fast and Slow",Daniel Kahneman,,0374533555,ISBN,0374533555
2991,Ray Dalio,The Spiritual Brain,Mario Beauregard,A Neuroscientist's Case for the Existence of the Soul,B000UZPH2Q,ASIN,
2992,Ray Dalio,The Power of Habit,Charles Duhigg,Why We Do What We Do in Life and Business,081298160X,ISBN,081298160X
2993,Ray Dalio,The Gift of Adversity,Norman E Rosenthal M.D.,"The Unexpected Benefits of Life's Difficulties, Setbacks, and Imperfections",B00AEBESTY,ASIN,
2994,Ray Dalio,Creativity and the Brain,Mario Tokoro,,9812700196,ISBN,9812700196
2995,Ray Dalio,The Upside of Inequality,Edward Conard,How Good Intentions Undermine the Middle Class,B016JPTFI2,ASIN,
2996,Ray Dalio,Learn or Die,Edward Hess,Using Science to Build a Leading-Edge Learning Organization,B00K33E4EC,ASIN,
2997,Ray Dalio,The Serengeti Rules,Sean B. Carroll,The Quest to Discover How Life Works and Why It Matters,0691175683,ISBN,0691175683
2998,Ray Dalio,In Over Our Heads,Robert Kegan,The Mental Demands of Modern Life,0674445880,ISBN,0674445880
2999,Ray Dalio,A Whole New Mind,Daniel Pink,Why Right-Brainers Will Rule the Future,B000PC0SPU,ASIN,
3000,Ray Dalio,You,Michael M. Lombardo,Being more effective in your MBTI Type,0974589284,ISBN,0974589284
3001,Ray Dalio,The Meaning of Human Existence,Edward O. Wilson,,B00J8R3IC8,ASIN,
3002,Ray Dalio,Incognito,David Eagleman,The Secret Lives of the Brain,B004J4WK9W,ASIN,
3003,Ray Dalio,Why We Believe in God(s),J. Anderson Thomson,A Concise Guide to the Science of Faith,B00LKBT04U,ASIN,
3004,Ray Dalio,The Role of the Individual in History,Georgii Valentinovich Plekhanov,,1410209482,ISBN,1410209482
3005,Ray Dalio,A Magic Web,Christian Ziegler,The Forest of Barro Colorado Island,0195143280,ISBN,0195143280
3006,Ray Dalio,Who's in Charge?,Michael S. Gazzaniga,Free Will and the Science of the Brain,B005UD1EVG,ASIN,
3007,Ray Dalio,Subliminal,Leonard Mlodinow,How Your Unconscious Mind Rules Your Behavior,B005X0K8CM,ASIN,
3008,Ray Dalio,Sapiens,Yuval Noah Harari,A Brief History of Humankind,0062316117,ISBN,0062316117
3009,Ray Dalio,An Everyone Culture,Robert Kegan,Becoming a Deliberately Developmental Organization,B01BO2ITX2,ASIN,
3010,Ray Dalio,The Evolving Self,Robert Kegan,Problem and Process in Human Development,0674272315,ISBN,0674272315
3011,Ray Dalio,Welcome to Your Brain,Sam Wang,Why You Lose Your Car Keys but Never Forget How to Drive and Other Puzzles of Everyday Life,B003TWOK8Y,ASIN,
3012,Ray Dalio,From Bacteria to Bach and Back,Daniel C. Dennett,The Evolution of Minds,0393242072,ISBN,0393242072
3013,Ray Dalio,Beyond Religion,Dalai Lama,Ethics for a Whole World,B005LVQZ3E,ASIN,
3014,Ray Dalio,Leadership the Outward Bound Way,Outward Bound USA,"Becoming a Better Leader in the Workplace, in the Wilderness, and in Your Community",159485033X,ISBN,159485033X
3015,Ray Dalio,Benjamin Franklin,Walter Isaacson,An American Life,074325807X,ISBN,074325807X
3016,Ray Dalio,Steve Jobs,Walter Isaacson,,1501127624,ISBN,1501127624
3017,Ray Dalio,My Stroke of Insight,Jill Bolte Taylor,A Brain Scientist's Personal Journey,B0019IB0II,ASIN,
3018,Ray Dalio,River Out of Eden,Richard Dawkins,A Darwinian View of Life,0465069908,ISBN,0465069908
3019,Ray Dalio,No Rules Rules,Reed Hastings,Netflix and the Culture of Reinvention,1984877860,ISBN,1984877860
3020,Ray Dalio,Einstein's Mistakes,Hans C. Ohanian,The Human Failings of Genius,B002SAUCG2,ASIN,
3021,Ray Dalio,Einstein,Walter Isaacson,His Life and Universe,0743264746,ISBN,0743264746
3022,Ray Dalio,Strength in Stillness,Bob Roth,The Power of Transcendental Meditation,1501161210,ISBN,1501161210
3023,Adam Sessler,The Source of Self-Regard,Toni Morrison,"Selected Essays, Speeches, and Meditations",0525562796,ISBN,0525562796
3024,Adam Sessler,Lush Life,Richard Price,,0312428227,ISBN,0312428227
3025,Adam Sessler,Paradise,Toni Morrison,,0804169888,ISBN,0804169888
3026,Adam Sessler,Absurdistan,Gary Shteyngart,A Novel,B000GCFWAU,ASIN,
3027,Adam Sessler,Clockers,Richard Price,,0747598207,ISBN,0747598207
3028,Adam Sessler,Light in August,William Faulkner,,0679732268,ISBN,0679732268
3029,Adam Sessler,The Green Lantern Vol. 1,Grant Morrison,Intergalactic Lawman,1401291392,ISBN,1401291392
3030,Adam Sessler,The Origin of Others,Toni Morrison,,0674976452,ISBN,0674976452
3031,Adam Sessler,What Moves at the Margin,Toni Morrison,Selected Nonfiction,160473017X,ISBN,160473017X
3032,Adam Sessler,Remember,Toni Morrison,The Journey to School Integration,061839740X,ISBN,061839740X
3033,Adam Sessler,Playing in the Dark,Toni Morrison,Whiteness and the Literary Imagination,0679745424,ISBN,0679745424
3034,Adam Sessler,God Help the Child,Toni Morrison,,0307740927,ISBN,0307740927
3035,Adam Sessler,Home,Toni Morrison,,0307740919,ISBN,0307740919
3036,Adam Sessler,A Mercy,Toni Morrison,,0307276767,ISBN,0307276767
3037,Adam Sessler,Love,Toni Morrison,A Novel,1400078474,ISBN,1400078474
3038,Adam Sessler,Jazz,Toni Morrison,,1400076218,ISBN,1400076218
3039,Adam Sessler,Beloved,Toni Morrison,,1400033411,ISBN,1400033411
3040,Adam Sessler,Tar Baby,Toni Morrison,,1400033446,ISBN,1400033446
3041,Adam Sessler,Song of Solomon,Toni Morrison,,140003342X,ISBN,140003342X
3042,Adam Sessler,Sula,Toni Morrison,,1400033438,ISBN,1400033438
3043,Adam Sessler,The Bluest Eye,Toni Morrison,,0307278441,ISBN,0307278441
3044,Adam Sessler,The Sellout,Paul Beatty,A Novel,1250083257,ISBN,1250083257
3045,Adam Sessler,The White Boy Shuffle,Paul Beatty,A Novel,031228019X,ISBN,031228019X
3046,Adam Sessler,Loving Day,Mat Johnson,A Novel,0812983661,ISBN,0812983661
3047,Adam Sessler,Lake Success,Gary Shteyngart,A Novel,0812987209,ISBN,0812987209
3048,Adam Sessler,Super Sad True Love Story,Gary Shteyngart,A Novel,0812977866,ISBN,0812977866
3049,Adam Sessler,Idoru,William Gibson,Bridge Trilogy Book 2,B000O76ONQ,ASIN,
3050,Adam Sessler,Pattern Recognition,William Gibson,Blue Ant Book 1,0425192938,ISBN,0425192938
3051,Adam Sessler,Count Zero,William Gibson,,B000PDYVZM,ASIN,
3052,Adam Sessler,Bloodbrothers,Richard Price,,0312428693,ISBN,0312428693
3053,Adam Sessler,The Book of Night Women,Marlon James,,1594484368,ISBN,1594484368
3054,Adam Sessler,A Brief History of Seven Killings,Marlon James,A Novel,1594633940,ISBN,1594633940
3055,Adam Sessler,The Nickel Boys,Colson Whitehead,A Novel,0385537077,ISBN,0385537077
3056,Adam Sessler,The Underground Railroad,Colson Whitehead,A Novel,B01A4ATV0A,ASIN,
3057,Adam Sessler,The Noble Hustle,Colson Whitehead,"Poker, Beef Jerky and Death",0345804333,ISBN,0345804333
3058,Adam Sessler,Zone One,Colson Whitehead,,0307455173,ISBN,0307455173
3059,Adam Sessler,Sag Harbor,Colson Whitehead,,0307455165,ISBN,0307455165
3060,Adam Sessler,Apex Hides the Hurt,Colson Whitehead,A Novel,1400031265,ISBN,1400031265
3061,Adam Sessler,The Colossus of New York,Colson Whitehead,,1400031249,ISBN,1400031249
3062,Adam Sessler,John Henry Days,Colson Whitehead,,0385498209,ISBN,0385498209
3063,Adam Sessler,The Intuitionist,Colson Whitehead,A Novel,0385493002,ISBN,0385493002
3064,Adam Sessler,Falling Man,Don DeLillo,A Novel,1416546065,ISBN,1416546065
3065,Adam Sessler,Great Jones Street,Don DeLillo,,0140179178,ISBN,0140179178
3066,Adam Sessler,Libra,Don DeLillo,,0141041994,ISBN,0141041994
3067,Adam Sessler,The Names,Don DeLillo,,0679722955,ISBN,0679722955
3068,Adam Sessler,Snopes,William Faulkner,"The Hamlet, The Town, The Mansion",B004JHYS6C,ASIN,
3069,Adam Sessler,"Absalom, Absalom!",William Faulkner,,B087S85ZH2,ASIN,
3070,Adam Sessler,The Unvanquished,William Faulkner,,0679736522,ISBN,0679736522
3071,Vinod Khosla,Life on the Edge,Johnjoe McFadden,The Coming of Age of Quantum Biology,B00RKO0KWM,ASIN,
3072,Vinod Khosla,Blitzscaling,Reid Hoffman,The Lightning-Fast Path to Building Massively Valuable Companies,1524761419,ISBN,1524761419
3073,Vinod Khosla,Lying,Sam Harris,,1940051002,ISBN,1940051002
3074,Vinod Khosla,Range,David J. Epstein,Why Generalists Triumph in a Specialized World,https://www.amazon.com/dp/B07H1ZYWTM?tag=danpink.com-recommendedbooks-20,ISBN,
3075,Vinod Khosla,The Brand Flip,Marty Neumeier,Why customers now run companies and how to profit from it,B012FUA6QU,ASIN,
3076,Vinod Khosla,Behave,Robert M. Sapolsky,The Biology of Humans at Our Best and Worst,B01IAUGC5S,ASIN,
3077,Vinod Khosla,Eating the Big Fish,Adam Morgan,How Challenger Brands Can Compete Against Brand Leaders,B0026REB8C,ASIN,
3078,Vinod Khosla,Deep Learning,Ian Goodfellow,,0262035618,ISBN,0262035618
3079,Vinod Khosla,Sapiens,Yuval Noah Harari,A Brief History of Humankind,0062316117,ISBN,0062316117
3080,Vinod Khosla,Scale,Geoffrey West,"The Universal Laws of Growth, Innovation, Sustainability, and the Pace of Life in Organisms, Cities, Economies, and Companies",1594205582,ISBN,1594205582
3081,Vinod Khosla,The Inflamed Mind,Edward Bullmore,A Radical New Approach to Depression,B07G133P1F,ASIN,
3082,Vinod Khosla,Lifespan,David Sinclair,Why We Ageâand Why We Don't Have To,B07N4C6LGR,ASIN,
3083,Vinod Khosla,McMafia,Misha Glenny,A Journey Through the Global Criminal Underworld,1400095123,ISBN,1400095123
3084,Vinod Khosla,The Jungle Grows Back,Robert Kagan,America and Our Imperiled World,B07B77NHYX,ASIN,
3085,Vinod Khosla,From Bacteria to Bach and Back,Daniel C. Dennett,The Evolution of Minds,0393242072,ISBN,0393242072
3086,Vinod Khosla,The Case Against Sugar,Gary Taubes,,0307946649,ISBN,0307946649
3087,Vinod Khosla,Loonshots,Safi Bahcall,"How to Nurture the Crazy Ideas That Win Wars, Cure Diseases, and Transform Industries",B07D2BKVQR,ASIN,
3088,Vinod Khosla,The Future of Capitalism,Paul Collier,Facing the New Anxieties,B077M9MCVW,ASIN,
3089,Vinod Khosla,What You Do Is Who You Are,Ben Horowitz,How to Create Your Business Culture,0062871331,ISBN,0062871331
3090,Vinod Khosla,The Master Algorithm,Pedro Domingos,How the Quest for the Ultimate Learning Machine Will Remake Our World,0465094279,ISBN,0465094279
3091,Vinod Khosla,The Last Days of Night,Graham Moore,A Novel,B01A4AXM3W,ASIN,
3092,Vinod Khosla,Against Empathy,Paul Bloom,The Case for Rational Compassion,0062339338,ISBN,0062339338
3093,Vinod Khosla,Troublemakers,Leslie Berlin,Silicon Valley's Coming of Age,1451651503,ISBN,1451651503
3094,Vinod Khosla,The Formula,Albert-LÃ¡szlÃ³ BarabÃ¡si,The Universal Laws of Success,B07B863X6B,ASIN,
3095,Vinod Khosla,Mindfulness in Plain English,Henepola Gunaratana,,B003XF1LKW,ASIN,
3096,Vinod Khosla,Drunk Tank Pink,Adam Alter,"And Other Unexpected Forces That Shape How We Think, Feel, and Behave",0143124935,ISBN,0143124935
3097,Vinod Khosla,Homo Deus,Yuval Noah Harari,A Brief History of Tomorrow,0062464345,ISBN,0062464345
3098,Vinod Khosla,How to Change Your Mind,Michael Pollan,"What the New Science of Psychedelics Teaches Us About Consciousness, Dying, Addiction, Depression, and Transcendence",B076GPJXWZ,ASIN,
3099,Vinod Khosla,Friday Black,Nana Kwame Adjei-Brenyah,,B07897SFZF,ASIN,
3100,Vinod Khosla,The Coddling of the American Mind,Greg Lukianoff,How Good Intentions and Bad Ideas Are Setting Up a Generation for Failure,0735224897,ISBN,0735224897
3101,Vinod Khosla,21 Lessons for the 21st Century,Yuval Noah Harari,,0525512179,ISBN,0525512179
3102,Vinod Khosla,The Uninhabitable Earth,David Wallace-Wells,Life After Warming,B07GVPFH5V,ASIN,
3103,Vinod Khosla,The Third Pillar,Raghuram Rajan,How Markets and the State Leave the Community Behind,B07DSZFVKS,ASIN,
3104,Vinod Khosla,An Elegant Defense,Matt Richtel,The Extraordinary New Science of the Immune System: A Tale in Four Lives,B07C66KJC1,ASIN,
3105,Vinod Khosla,Other People's Money,Charles V. Bagli,Inside the Housing Crisis and the Demise of the Greatest Real Estate Deal Ever Made,0142180718,ISBN,0142180718
3106,Vinod Khosla,This Is Your Brain on Music,Daniel J. Levitin,The Science of a Human Obsession,0452288525,ISBN,0452288525
3107,Vinod Khosla,Atomic Habits,James Clear,An Easy & Proven Way to Build Good Habits & Break Bad Ones,B07D23CFGR,ASIN,
3108,Vinod Khosla,The $12 Million Stuffed Shark,Donald N. Thompson,The Curious Economics of Contemporary Art,B0077QZ208,ASIN,
3109,Vinod Khosla,Astrophysics for People in a Hurry,Neil deGrasse Tyson,,0393609391,ISBN,0393609391
3110,Vinod Khosla,The Line Becomes a River,Francisco CantÃº,Dispatches from the Border,B072SSGP1K,ASIN,
3111,Vinod Khosla,The Age of Surveillance Capitalism,Shoshana Zuboff,The Fight for a Human Future at the New Frontier of Power,B01N2QEZE2,ASIN,
3112,Vinod Khosla,The Breakthrough,Charles Graeber,Immunotherapy and the Race to Cure Cancer,B07B8DHDJL,ASIN,
3113,Vinod Khosla,Winners Take All,Anand Giridharadas,The Elite Charade of Changing the World,0451493249,ISBN,0451493249
3114,Vinod Khosla,The Peacemaker's Code,Deepak Malhotra,,B08TLR3HCT,ASIN,
3115,Noah Kagan,"Everybody, Always",Bob Goff,Becoming Love in a World Full of Setbacks and Difficult People,0718078136,ISBN,0718078136
3116,Noah Kagan,Smartcuts,Shane Snow,The Breakthrough Power of Lateral Thinking,0062560751,ISBN,0062560751
3117,Noah Kagan,The Big Leap,Gay Hendricks,Conquer Your Hidden Fear and Take Life to the Next Level,0061735345,ISBN,0061735345
3118,Noah Kagan,Permission Marketing,Seth Godin,Turning Strangers into Friends and Friends into Customers,0684856360,ISBN,0684856360
3119,Noah Kagan,Million Dollar Consulting,Alan Weiss,The Professional's Guide to Growing a Practice,1259588610,ISBN,1259588610
3120,Noah Kagan,Coach Wooden and Me,Kareem Abdul-Jabbar,Our 50-Year Friendship On and Off the Court,1455542261,ISBN,1455542261
3121,Noah Kagan,On Killing,Dave Grossman,The Psychological Cost of Learning to Kill in War and Society,0316040932,ISBN,0316040932
3122,Noah Kagan,The Sales Acceleration Formula,Mark Roberge,"Using Data, Technology, and Inbound Selling to go from $0 to $100 Million",1119047072,ISBN,1119047072
3123,Noah Kagan,Recession Proof Graduate,Charlie Hoehn,How to Land the Job You Want by Doing Free Work,0990354814,ISBN,0990354814
3124,Noah Kagan,Essentialism,Greg Mckeown,The Disciplined Pursuit of Less,0753555166,ISBN,0753555166
3125,Noah Kagan,The Way of the Superior Man,David Deida,"A Spiritual Guide to Mastering the Challenges of Women, Work, and Sexual Desire",B01NA993PI,ASIN,
3126,Noah Kagan,The Paradox of Choice,Barry Schwartz,Why More Is Less,0062449923,ISBN,0062449923
3127,Noah Kagan,Ogilvy on Advertising,David Ogilvy,,039472903X,ISBN,039472903X
3128,Noah Kagan,"Surely You're Joking, Mr. Feynman!",Richard P. Feynman,Adventures of a Curious Character,0393355624,ISBN,0393355624
3129,Noah Kagan,Endure,Alex Hutchinson,"Mind, Body, and the Curiously Elastic Limits of Human Performance",0062499866,ISBN,0062499866
3130,Noah Kagan,Your Brain at Work,David Rock,"Strategies for Overcoming Distraction, Regaining Focus, and Working Smarter All Day Long",0061771295,ISBN,0061771295
3131,Noah Kagan,The Ultimate Sales Machine,Chet Holmes,Turbocharge Your Business with Relentless Focus on 12 Key Strategies,1591842158,ISBN,1591842158
3132,Noah Kagan,Who,Geoff Smart,The A Method for Hiring,B002VLL5AK,ASIN,
3133,Noah Kagan,SPIN Selling,Neil Rackham,,B0081USDU0,ASIN,
3134,Noah Kagan,Small Giants,Bo Burlingham,Companies That Choose to Be Great Instead of Big,014310960X,ISBN,014310960X
3135,Noah Kagan,Love Does,Bob Goff,Discover a Secretly Incredible Life in an Ordinary World,1400203759,ISBN,1400203759
3136,Noah Kagan,Mindless Eating,Brian Wansink Ph.d.,Why We Eat More Than We Think,0553384481,ISBN,0553384481
3137,Noah Kagan,Influence,Robert B. Cialdini PhD,The Psychology of Persuasion,006124189X,ISBN,006124189X
3138,Noah Kagan,The Boron Letters,Gary Halbert,,B00BMWEFR4,ASIN,
3139,Noah Kagan,Replay,Ken Grimwood,,068816112X,ISBN,068816112X
3140,Noah Kagan,Setting the Table,Danny Meyer,The Transforming Power of Hospitality in Business,0060742763,ISBN,0060742763
3141,Noah Kagan,The 7 Habits of Highly Effective People,Stephen R. Covey,Powerful Lessons in Personal Change,1471131823,ISBN,1471131823
3142,Noah Kagan,Beat the Reaper,Josh Bazell,A Novel,B001NXK242,ASIN,
3143,Noah Kagan,Losing the Signal,Jacquie McNish,The Untold Story Behind the Extraordinary Rise and Spectacular Fall of BlackBerry,1250060176,ISBN,1250060176
3144,Noah Kagan,The Fountainhead,Ayn Rand,,0141188626,ISBN,0141188626
3145,Noah Kagan,Women Who Love Too Much,Robin Norwood,When You Keep Wishing and Hoping He'll Change,1416550216,ISBN,1416550216
3146,Noah Kagan,The Score Takes Care of Itself,Bill Walsh,My Philosophy of Leadership,1591843472,ISBN,1591843472
3147,Noah Kagan,Purple Cow,Seth Godin,Transform Your Business by Being Remarkable,1591843170,ISBN,1591843170
3148,Noah Kagan,Sex at Dawn,Christopher Ryan,"How We Mate, Why We Stray, and What It Means for Modern Relationships",0061707813,ISBN,0061707813
3149,Noah Kagan,The Power of Full Engagement,Jim Loehr,"Managing Energy, Not Time, Is the Key to High Performance and Personal Renewal",0743226755,ISBN,0743226755
3150,Noah Kagan,Maverick,Ricardo Semler,The Success Story Behind the World's Most Unusual Workplace,0446670553,ISBN,0446670553
3151,Noah Kagan,The Martian,Andy Weir,A Novel,0553418025,ISBN,0553418025
3152,Noah Kagan,Rocket Men,Robert Kurson,The Daring Odyssey of Apollo 8 and the Astronauts Who Made Man's First Journey to the Moon,B073QYYY55,ASIN,
3153,Noah Kagan,Tiger Woods,Jeff Benedict,,150112644X,ISBN,150112644X
3154,Noah Kagan,The Legend Trilogy,Marie Lu,,039916667X,ISBN,039916667X
3155,Noah Kagan,The Celestine Prophecy,James Redfield,,153873026X,ISBN,153873026X
3156,Noah Kagan,Nice Girls Don't Get the Corner Office,Lois P. Frankel PhD,Unconscious Mistakes Women Make That Sabotage Their Careers,1455546046,ISBN,1455546046
3157,Brian Armstrong,Startups,Chris Dixon,Notes on Tech Startups and Venture Capital,https://www.scribd.com/document/53315533/startups-book?tag=mostrecommendedbooks-20,ISBN,
3158,Brian Armstrong,The Dip,Seth Godin,A Little Book That Teaches You When to Quit (and When to Stick),1591841666,ISBN,1591841666
3159,Brian Armstrong,The Psychology of Achievement,Brian Tracy,,0743526589,ISBN,0743526589
3160,Brian Armstrong,Lying,Sam Harris,,1940051002,ISBN,1940051002
3161,Brian Armstrong,The Economics of Microfinance,Beatriz ArmendÃ¡riz,,0262513986,ISBN,0262513986
3162,Brian Armstrong,How to Talk So Kids Will Listen & Listen So Kids Will Talk,Adele Faber,,1451663889,ISBN,1451663889
3163,Brian Armstrong,The Female Brain,Louann Brizendine,,0767920104,ISBN,0767920104
3164,Brian Armstrong,"When I Say No, I Feel Guilty",Manuel J. Smith,,0553263900,ISBN,0553263900
3165,Brian Armstrong,The Four Obsessions of an Extraordinary Executive,Patrick Lencioni,A Leadership Fable,0787954039,ISBN,0787954039
3166,Brian Armstrong,The Pleasure of Finding Things Out,Richard P. Feynman,The Best Short Works of Richard P. Feynman,B005QBLHB4,ASIN,
3167,Brian Armstrong,Hackers & Painters,Paul Graham,Big Ideas from the Computer Age,1449389554,ISBN,1449389554
3168,Brian Armstrong,Eisenhower in War and Peace,Jean Edward Smith,,0812982886,ISBN,0812982886
3169,Brian Armstrong,The Wright Brothers,David McCullough,,1476728747,ISBN,1476728747
3170,Brian Armstrong,The Sovereign Individual,James Dale Davidson,Mastering the Transition to the Information Age,0684832720,ISBN,0684832720
3171,Brian Armstrong,The Outsiders,William N. Thorndike,Eight Unconventional CEOs and Their Radically Rational Blueprint for Success,1422162672,ISBN,1422162672
3172,Brian Armstrong,The Inmates Are Running the Asylum,Alan Cooper,Why High Tech Products Drive Us Crazy and How to Restore the Sanity,0672326140,ISBN,0672326140
3173,Brian Armstrong,Sperm Wars,Robin Baker,"Infidelity, Sexual Conflict, and Other Bedroom Battles",1560258489,ISBN,1560258489
3174,Brian Armstrong,Learning To Love Yourself,Gay Hendricks Ph.D.,,1439274290,ISBN,1439274290
3175,Brian Armstrong,Good to Great,Jim Collins,Why Some Companies Make the Leap...And Others Don't,0066620996,ISBN,0066620996
3176,Brian Armstrong,Don't Make Me Think,Steve Krug,A Common Sense Approach to Web Usability ,0321965515,ISBN,0321965515
3177,Brian Armstrong,"Surely You're Joking, Mr. Feynman!",Richard P. Feynman,Adventures of a Curious Character,0393355624,ISBN,0393355624
3178,Brian Armstrong,Turn the Ship Around!,L. David Marquet,A True Story of Turning Followers into Leaders,1591846404,ISBN,1591846404
3179,Brian Armstrong,The Selfish Gene,Richard Dawkins,,0198788606,ISBN,0198788606
3180,Brian Armstrong,The 15 Commitments of Conscious Leadership,Jim Dethmer,A New Paradigm for Sustainable Success,B00R3MHWUE,ASIN,
3181,Brian Armstrong,Strengths Based Leadership,Tom Rath,"Great Leaders, Teams, and Why People Follow",1595620257,ISBN,1595620257
3182,Brian Armstrong,Shoe Dog,Phil Knight,A Memoir by the Creator of Nike,B0176M1A44,ASIN,
3183,Brian Armstrong,Pilot's Handbook of Aeronautical Knowledge,Federal Aviation Administration (FAA)/Aviation Supplies & Academics (ASA),,1619544733,ISBN,1619544733
3184,Brian Armstrong,Made to Stick,Chip Heath,Why Some Ideas Survive and Others Die,1400064287,ISBN,1400064287
3185,Brian Armstrong,High Output Management,Andrew S. Grove,,0679762884,ISBN,0679762884
3186,Brian Armstrong,Becoming Steve Jobs,Brent Schlender,The Evolution of a Reckless Upstart into a Visionary Leader,0385347421,ISBN,0385347421
3187,Brian Armstrong,Atlas Shrugged,Ayn Rand,,0452011876,ISBN,0452011876
3188,Brian Armstrong,The Singularity Is Near,Ray Kurzweil,When Humans Transcend Biology,0143037889,ISBN,0143037889
3189,Brian Armstrong,The God Delusion,Richard Dawkins,,0618680004,ISBN,0618680004
3190,Brian Armstrong,The Alliance,Reid Hoffman,Managing Talent in the Networked Age,1625275773,ISBN,1625275773
3191,Brian Armstrong,The 22 Immutable Laws of Marketing,Al Ries,Violate Them at Your Own Risk,0887306667,ISBN,0887306667
3192,Brian Armstrong,Ready Player One,Ernest Cline,,0804190135,ISBN,0804190135
3193,Brian Armstrong,Humans Need Not Apply,Jerry Kaplan,A Guide to Wealth and Work in the Age of Artificial Intelligence,0300213557,ISBN,0300213557
3194,Brian Armstrong,The New One Minute Manager,Ken Blanchard,,006239312X,ISBN,006239312X
3195,Brian Armstrong,High Growth Handbook,Elad Gil,,B07DRPGGQ7,ASIN,
3196,Jeff Bezos,Built to Last,Jim Collins,Successful Habits of Visionary Companies,0060516402,ISBN,0060516402
3197,Jeff Bezos,The Remains of the Day,Kazuo Ishiguro,,B003VPWX6K,ASIN,
3198,Jeff Bezos,Creation,Steve Grand,Life and How to Make It,0753812770,ISBN,0753812770
