,influencer,title,author,subtitle,id_code,identifier_type,ISBN
4635,Simon Sinek,Everybody Matters,Bob Chapman,The Extraordinary Power of Caring for Your People Like Family,1591847796,ISBN,1591847796
4636,Simon Sinek,Quiet,Susan Cain,The Power of Introverts in a World That Can't Stop Talking,0307352153,ISBN,0307352153
4637,Simon Sinek,"Guns, Germs, and Steel",Jared Diamond,The Fates of Human Societies,0393354326,ISBN,0393354326
4638,Simon Sinek,Finite and Infinite Games,James Carse,,1476731713,ISBN,1476731713
4639,Simon Sinek,Unbinding the Heart,Agapi Stassinopoulos,"A Dose of Greek Wisdom, Generosity, and Unconditional Love",1401930743,ISBN,1401930743
4640,Simon Sinek,Ghost Wars,Steve Coll,"The Secret History of the CIA, Afghanistan, and Bin Laden, from the Soviet Invasion to September 10, 2001",0143034669,ISBN,0143034669
4641,Simon Sinek,It's Your Business,JJ Ramberg,183 Essential Tips that Will Transform Your Small Business,1455509000,ISBN,1455509000
4642,Simon Sinek,1421,Gavin Menzies,The Year China Discovered America,0061564893,ISBN,0061564893
4643,Simon Sinek,Turn the Ship Around!,L. David Marquet,A True Story of Turning Followers into Leaders,1591846404,ISBN,1591846404
4644,Ryan Petersen,The Complete Story of Civilization,Will Durant,,B00HT53KV0,ASIN,
4645,Ryan Petersen,The Origin of Wealth,Eric D. Beinhocker,The Radical Remaking of Economics and What it Means for Business and Society,1422121038,ISBN,1422121038
4646,Ryan Petersen,A Sense of Where You Are,John McPhee,Bill Bradley at Princeton,0374526893,ISBN,0374526893
4647,Ryan Petersen,Certain to Win,Chet Richards,"The Strategy of John Boyd, Applied to Business",1413453767,ISBN,1413453767
4648,Ryan Petersen,The Great CEO Within,Matt Mochary,The Tactical Guide to Company Building,0578599287,ISBN,0578599287
4649,Ryan Petersen,Conquerors,Roger Crowley,How Portugal Forged the First Global Empire,0812994000,ISBN,0812994000
4650,Ryan Petersen,Berlitz Essential Spanish,Berlitz Guides,,9812465316,ISBN,9812465316
4651,Ryan Petersen,The Art Of War,Sun Tzu,,1599869772,ISBN,1599869772
4652,Ryan Petersen,The Southwest Airlines Way,Jody Hoffer Gittell,,0071458271,ISBN,0071458271
4653,Ryan Petersen,Economics in One Lesson,Henry Hazlitt,The Shortest and Surest Way to Understand Basic Economics,0517548232,ISBN,0517548232
4654,Ryan Petersen,The Great Wave,David Hackett Fischer,Price Revolutions and the Rhythm of History,019512121X,ISBN,019512121X
4655,Ryan Petersen,Before the Industrial Revolution,Carlo M. Cipolla,"European Society and Economy, 1000-1700",0393311988,ISBN,0393311988
4656,Ryan Petersen,High Growth Handbook,Elad Gil,,B07DRPGGQ7,ASIN,
4657,Ryan Petersen,Big History,DK,"Examines Our Past, Explains Our Present, Imagines Our Future",1465454438,ISBN,1465454438
4658,Ryan Petersen,MONEY Master the Game,Tony Robbins,7 Simple Steps to Financial Freedom,1476757801,ISBN,1476757801
4659,Neil Strauss,Under Saturn's Shadow,James Hollis,,0919123643,ISBN,0919123643
4660,Neil Strauss,Ulysses,James Joyce,,1505297540,ISBN,1505297540
4661,Neil Strauss,Life Is Elsewhere,Milan Kundera,,0571197779,ISBN,0571197779
4662,Neil Strauss,Maxims,FranÃ§ois duc de La Rochefoucauld,,1331355311,ISBN,1331355311
4663,Neil Strauss,Nonviolent Communication,Marshall B. Rosenberg,A Language of Life: Life-Changing Tools for Healthy Relationships,189200528X,ISBN,189200528X
4664,Neil Strauss,Journey to the End of the Night,Louis-Ferdinand CÃ©line,,0811216543,ISBN,0811216543
4665,Neil Strauss,The Painted Bird,Jerzy Kosinski,,080213422X,ISBN,080213422X
4666,Neil Strauss,On the Shortness of Life,Lucius Seneca,,1781399573,ISBN,1781399573
4667,Neil Strauss,One Hundred Years of Solitude,Gabriel Garcia Marquez,,0060883286,ISBN,0060883286
4668,Neil Strauss,Ask the Dust,John Fante,,0060822554,ISBN,0060822554
4669,Neil Strauss,StrengthsFinder 2.0,Tom Rath,,159562015X,ISBN,159562015X
4670,Neil Strauss,Siddhartha,Hermann Hesse,,1519150245,ISBN,1519150245
4671,Neil Strauss,Meditations,Marcus Aurelius,,1719129274,ISBN,1719129274
4672,Neil Strauss,The Continuum Concept,Jean Liedloff,In Search Of Happiness Lost,0201050714,ISBN,0201050714
4673,Anderson Cooper,Iron and Silk,Mark Salzman,,0394551567,ISBN,0394551567
4674,Anderson Cooper,The Hellfire Club,Jake Tapper,,031647231X,ISBN,031647231X
4675,Anderson Cooper,Beautiful Ruins,Jess Walter,A Novel,0061928178,ISBN,0061928178
4676,Anderson Cooper,The End of Your Life Book Club,Will Schwalbe,,0307739783,ISBN,0307739783
4677,Anderson Cooper,Fire Shut Up in My Bones,Charles M. Blow,,0544570111,ISBN,0544570111
4678,Anderson Cooper,American Heiress,Jeffrey Toobin,"The Wild Saga of the Kidnapping, Crimes and Trial of Patty Hearst",B018CH9ZQC,ASIN,
4679,Anderson Cooper,Books for Living,Will Schwalbe,,B01FPGY5VI,ASIN,
4680,Anderson Cooper,Scores,Michael D. Blutrich,"How I Opened the Hottest Strip Club in New York City, Was Extorted out of Millions by the Gambino Family, and Became One of the Most Successful Mafia Informants in FBI History",B01M3NUAEN,ASIN,
4681,Anderson Cooper,Most Talkative,Andy Cohen,,125003146X,ISBN,125003146X
4682,Anderson Cooper,In Defense of a Liberal Education,Fareed Zakaria,,039335234X,ISBN,039335234X
4683,Anderson Cooper,How to Survive a Plague,David France,The Inside Story of How Citizens and Science Tamed AIDS,B01CMH15DE,ASIN,
4684,Anderson Cooper,Gone Girl,Gillian Flynn,,0307588378,ISBN,0307588378
4685,Anderson Cooper,Wheelmen,Reed Albergotti,"Lance Armstrong, the Tour de France, and the Greatest Sports Conspiracy Ever",B00C1N92YY,ASIN,
4686,Anderson Cooper,The Only Plane in the Sky,Garrett M. Graff,An Oral History of 9/11,150118220X,ISBN,150118220X
4687,Alexandria Ocasio-Cortez,Consider the Lobster and Other Essays,David Foster Wallace,,0316013323,ISBN,0316013323
4688,Alexandria Ocasio-Cortez,Hope in the Dark,Rebecca Solnit,"Untold Histories, Wild Possibilities",1608465764,ISBN,1608465764
4689,Alexandria Ocasio-Cortez,Capital in the Twenty-First Century,Thomas Piketty,,B074DVRW88,ASIN,
4690,Alexandria Ocasio-Cortez,One Hundred Years of Solitude,Gabriel Garcia Marquez,,0060883286,ISBN,0060883286
4691,Alexandria Ocasio-Cortez,Team of Rivals,Doris Kearns Goodwin,The Political Genius of Abraham Lincoln,B000N2HBSO,ASIN,
4692,Alexandria Ocasio-Cortez,The Bhagavad Gita,-,,1586380192,ISBN,1586380192
4693,Alexandria Ocasio-Cortez,Infinite Jest,David Foster Wallace,,0316066524,ISBN,0316066524
4694,Alexandria Ocasio-Cortez,Why We Can't Wait,Dr. Martin Luther King Jr.,,0451527534,ISBN,0451527534
4695,Alexandria Ocasio-Cortez,The Search for Common Ground,Howard Thurman,,0913408948,ISBN,0913408948
4696,Alexandria Ocasio-Cortez,The Collected Poems of Audre Lorde,Audre Lorde,,0393319725,ISBN,0393319725
4697,Alan Kay,A Programming Language,Kenneth E. Iverson,,0471430145,ISBN,0471430145
4698,Alan Kay,The Art of the Metaobject Protocol,Gregor Kiczales,,0262610744,ISBN,0262610744
4699,Alan Kay,The Sciences of the Artificial,Herbert A Simon,,0262691914,ISBN,0262691914
4700,Alan Kay,Computation,Marvin Lee Minsky,Finite and Infinite Machines,0131655639,ISBN,0131655639
4701,Alan Kay,LISP 1.5 Programmer's Manual,John McCarthy,,0262130114,ISBN,0262130114
4702,Alan Kay,The Principia,Isaac Newton,The Authoritative Translation and Guide: Mathematical Principles of Natural Philosophy,0520290887,ISBN,0520290887
4703,Alan Kay,The Organ-Builder,Francois Bedos de Celles,,091554802X,ISBN,091554802X
4704,Alan Kay,The Mythical Man-Month,Frederick P. Brooks Jr.,Essays on Software Engineering,0201835959,ISBN,0201835959
4705,Alan Kay,Molecular Biology of the Cell,Bruce Alberts,,0815344325,ISBN,0815344325
4706,Alan Kay,Mythology,Edith Hamilton,,0316223344,ISBN,0316223344
4707,Alan Kay,Advances in Programming and Non-Numerical Computation,L Fox,,B01DRXIZOE,ASIN,
4708,Alan Kay,Art in the Blood,Bonnie MacBird,A Sherlock Holmes Adventure,B00YGDLAFG,ASIN,
4709,Alan Kay,Molecular Biology of the Gene,James D. Watson,,0321762436,ISBN,0321762436
4710,Alan Kay,Twenty Thousand Leagues Under the Sea,Jules Verne,,B01KUGTMQG,ASIN,
4711,Lewis Cantley,The System of the World,Neal Stephenson,"The Baroque Cycle, Vol. 3",0060750863,ISBN,0060750863
4712,Lewis Cantley,Metropolis,Philip Kerr,Book 14,B07FS7B6P2,ASIN,
4713,Lewis Cantley,Greeks Bearing Gifts,Philip Kerr,Book 13,B0755Z97TP,ASIN,
4714,Lewis Cantley,Prussian Blue,Philip Kerr,Book 12,B01IAUG6RC,ASIN,
4715,Lewis Cantley,The Other Side of Silence,Philip Kerr,Book 11,B00TY3ZS1K,ASIN,
4716,Lewis Cantley,The Lady from Zagreb,Philip Kerr,Book 10,B00O4RHN82,ASIN,
4717,Lewis Cantley,A Man Without Breath,Philip Kerr,Book 9,B00AI5APIY,ASIN,
4718,Lewis Cantley,Prague Fatale,Philip Kerr,Book 8,B0072NWKEC,ASIN,
4719,Lewis Cantley,Field Gray,Philip Kerr,Book 7,B004IYITLQ,ASIN,
4720,Lewis Cantley,If The Dead Rise Not,Philip Kerr,Book 6,B0030CVRFM,ASIN,
4721,Lewis Cantley,A Quiet Flame,Philip Kerr,Book 5,B001SCK73E,ASIN,
4722,Lewis Cantley,The One from the Other,Philip Kerr,Book 4,B001O2NEHY,ASIN,
4723,Lewis Cantley,Berlin Noir,Philip Kerr,The First Three Bernie Gunther Novels,B006LFO1DA,ASIN,
4724,Lewis Cantley,The Confusion,Neal Stephenson,"The Baroque Cycle, Vol. 2",0060733357,ISBN,0060733357
4725,Lewis Cantley,Quicksilver,Neal Stephenson,"The Baroque Cycle, Vol. 1",0060593083,ISBN,0060593083
4726,Lewis Cantley,The Making of the Atomic Bomb,Richard Rhodes,,1451677618,ISBN,1451677618
4727,Kevin Rose,The Wisdom of Crowds,James Surowiecki,,0349116059,ISBN,0349116059
4728,Kevin Rose,Delivering Happiness,Tony Hsieh,"A Path to Profits, Passion, and Purpose",0446563048,ISBN,0446563048
4729,Kevin Rose,"Zen Mind, Beginner's Mind",Shunryu Suzuki,Informal Talks on Zen Meditation and Practice,1590308492,ISBN,1590308492
4730,Kevin Rose,The Miracle of Mindfulness,Thich Nhat Hanh,An Introduction to the Practice of Meditation,0807012394,ISBN,0807012394
4731,Kevin Rose,The Intelligent Investor,Benjamin Graham,,B000FC12C8,ASIN,
4732,Kevin Rose,Essentialism,Greg Mckeown,The Disciplined Pursuit of Less,0753555166,ISBN,0753555166
4733,Kevin Rose,8 Weeks to Optimum Health,Andrew Weil,A Proven Program for Taking Full Advantage of Your Body's Natural Healing Power,034549802X,ISBN,034549802X
4734,Kevin Rose,The Longevity Diet,Valter Longo,"Discover the New Science Behind Stem Cell Activation and Regeneration to Slow Aging, Fight Disease, and Optimize Weight",0525534075,ISBN,0525534075
4735,Kevin Rose,The Tipping Point,Malcolm Gladwell,How Little Things Can Make a Big Difference,0316346624,ISBN,0316346624
4736,Kevin Rose,Tools of Titans,Tim Ferriss,"The Tactics, Routines, and Habits of Billionaires, Icons, and World-Class Performers",1328683788,ISBN,1328683788
4737,Kevin Rose,Forest Bathing,Dr. Qing Li,How Trees Can Help You Find Health and Happiness,052555985X,ISBN,052555985X
4738,Kevin Rose,Envisioning Information,Edward R. Tufte,,0961392118,ISBN,0961392118
4739,Jonathan Eisen,National Geographic Field Guide to the Birds of North America,Jon L. Dunn,,1426218354,ISBN,1426218354
4740,Jonathan Eisen,Virus,Marilyn J. Roossinck,An Illustrated Guide to 101 Incredible Microbes,069116696X,ISBN,069116696X
4741,Jonathan Eisen,Beating Back the Devil,Maryn McKenna,,1439123101,ISBN,1439123101
4742,Jonathan Eisen,A Planet of Viruses,Carl Zimmer,,0226983366,ISBN,0226983366
4743,Jonathan Eisen,Biohazard,Ken Alibek,The Chilling True Story of the Largest Covert Biological Weapons Program in the World--Told from Inside by the Man Who Ran It,0385334966,ISBN,0385334966
4744,Jonathan Eisen,The Eleventh Plague,Leonard A. Cole,The Politics of Biological and Chemical Warfare,0716733013,ISBN,0716733013
4745,Jonathan Eisen,Pandemic 1918,Catharine Arnold,Eyewitness Accounts from the Greatest Medical Holocaust in Modern History,1250139430,ISBN,1250139430
4746,Jonathan Eisen,Flu,Gina Kolata,The Story Of The Great Influenza Pandemic of 1918 and the Search for the Virus that Caused It,0743203984,ISBN,0743203984
4747,Jonathan Eisen,Level 4,Joseph B McCormick,Virus Hunters of the CDC,0760712085,ISBN,0760712085
4748,Jonathan Eisen,The Hot Zone,Richard Preston,The Terrifying True Story of the Origins of the Ebola Virus,0385479565,ISBN,0385479565
4749,Jonathan Eisen,Microbe Hunters,Paul de Kruif,,0156027771,ISBN,0156027771
4750,Jonathan Eisen,The Coming Plague,Laurie Garrett,Newly Emerging Diseases in a World Out of Balance,0140250913,ISBN,0140250913
4751,Jonathan Eisen,Spillover,David Quammen,Animal Infections and the Next Human Pandemic,0393346617,ISBN,0393346617
4752,Stewart Butterfield,Play Anything,Ian Bogost,"The Pleasure of Limits, the Uses of Boredom, and the Secret of Games",0465051723,ISBN,0465051723
4753,Stewart Butterfield,Team of Rivals,Doris Kearns Goodwin,The Political Genius of Abraham Lincoln,B000N2HBSO,ASIN,
4754,Stewart Butterfield,The Making of a Manager,Julie Zhuo,What to Do When Everyone Looks to You,0735219567,ISBN,0735219567
4755,Stewart Butterfield,Death Rattle,Alex Gilly,,0765377330,ISBN,0765377330
4756,Stewart Butterfield,The Courage to Be Disliked,Ichiro Kishimi,The Japanese Phenomenon That Shows You How to Change Your Life and Achieve Real Happiness,1501197274,ISBN,1501197274
4757,Stewart Butterfield,How to Change Your Mind,Michael Pollan,"What the New Science of Psychedelics Teaches Us About Consciousness, Dying, Addiction, Depression, and Transcendence",B076GPJXWZ,ASIN,
4758,Stewart Butterfield,Leadership and Self-Deception,The Arbinger Institute,Getting Out of the Box,1523097809,ISBN,1523097809
4759,Stewart Butterfield,Crucial Conversations,Kerry Patterson,Tools for Talking When Stakes Are High,0071775307,ISBN,0071775307
4760,Stewart Butterfield,Devil's Harbor,Alex Gilly,A Novel,0765377322,ISBN,0765377322
4761,Stewart Butterfield,Charged,Emily Bazelon,The New Movement to Transform American Prosecution and End Mass Incarceration,0399590013,ISBN,0399590013
4762,Stewart Butterfield,Hillbilly Elegy,J. D. Vance,A Memoir of a Family and Culture in Crisis,B079L5DDB4,ASIN,
4763,Stewart Butterfield,The Rise and Fall of American Growth,Robert J. Gordon,The U.S. Standard of Living since the Civil War,0691147728,ISBN,0691147728
4764,Whitney Cummings,Getting the Love You Want,Harville Hendrix Ph.D.,A Guide for Couples,1250310539,ISBN,1250310539
4765,Whitney Cummings,The Tools,Phil Stutz,"Transform Your Problems into Courage, Confidence, and Creativity",067964444X,ISBN,067964444X
4766,Whitney Cummings,Super Sad True Love Story,Gary Shteyngart,A Novel,0812977866,ISBN,0812977866
4767,Whitney Cummings,The Female Brain,Louann Brizendine,,0767920104,ISBN,0767920104
4768,Whitney Cummings,The Fantasy Bond,Robert W. Firestone PhD,Structure of Psychological Defenses,0967668409,ISBN,0967668409
4769,Whitney Cummings,Codependent No More,Melody Beattie,How to Stop Controlling Others and Start Caring for Yourself,0894864025,ISBN,0894864025
4770,Whitney Cummings,The Drama of the Gifted Child,Alice Miller,The Search for the True Self,0465016901,ISBN,0465016901
4771,Whitney Cummings,Sapiens,Yuval Noah Harari,A Brief History of Humankind,0062316117,ISBN,0062316117
4772,Whitney Cummings,The Continuum Concept,Jean Liedloff,In Search Of Happiness Lost,0201050714,ISBN,0201050714
4773,Whitney Cummings,Animal Farm,George Orwell,,0451526341,ISBN,0451526341
4774,Eric Ripert,Paroles,Jacques PrÃ©vert,,B01N6NU5HH,ASIN,
4775,Eric Ripert,My Father's Glory & My Mother's Castle,Marcel Pagnol,,0865472572,ISBN,0865472572
4776,Eric Ripert,Kitchen Confidential,Anthony Bourdain,Adventures in the Culinary Underbelly,0060899220,ISBN,0060899220
4777,Eric Ripert,Cooking with the Seasons,Jean Louis Palladin,,B00FXXNMDQ,ASIN,
4778,Eric Ripert,A Plea for the Animals,Matthieu Ricard,"The Moral, Philosophical, and Evolutionary Imperative to Treat All Beings with Compassion",1611803055,ISBN,1611803055
4779,Eric Ripert,The Quantum and the Lotus,Matthieu Ricard,A Journey to the Frontiers Where Science and Buddhism Meet,1400080797,ISBN,1400080797
4780,Eric Ripert,The Prince,NiccolÃ² Machiavelli,,0486272745,ISBN,0486272745
4781,Eric Ripert,The Alchemist,Paulo Coelho,,0062315005,ISBN,0062315005
4782,Eric Ripert,Sexus,Henry Miller,The Rosy Crucifixion I,0802151809,ISBN,0802151809
4783,Eric Ripert,Paul Bocuse's French Cooking,Paul Bocuse,,0394406702,ISBN,0394406702
4784,Eric Ripert,Cent ÃlÃ©phants sur un Brin D'Herbe,Dalai Lama,,2020314363,ISBN,2020314363
4785,Eric Ripert,"Bright Lights, Big City",Jay McInerney,,0394726413,ISBN,0394726413
4786,Tom Peters,Simply Brilliant,William C. Taylor,How Great Organizations Do Ordinary Things in Extraordinary Ways,1591847753,ISBN,1591847753
4787,Tom Peters,Rework,David DHH Heinemeier Hansson,,0307463745,ISBN,0307463745
4788,Tom Peters,Small Giants,Bo Burlingham,Companies That Choose to Be Great Instead of Big,014310960X,ISBN,014310960X
4789,Tom Peters,Wait,Frank Partnoy,,1610392477,ISBN,1610392477
4790,Tom Peters,Weapons of Math Destruction,Cathy O'Neil,How Big Data Increases Inequality and Threatens Democracy,0553418815,ISBN,0553418815
4791,Tom Peters,Hidden Champions of the Twenty-First Century,Hermann Simon,The Success Strategies of Unknown World Market Leaders,0387981462,ISBN,0387981462
4792,Tom Peters,Brotopia,Emily Chang,Breaking Up the Boys' Club of Silicon Valley,0525540172,ISBN,0525540172
4793,Tom Peters,The Power of Nice,Linda Kaplan Thaler,How to Conquer the Business World With Kindness,0385518927,ISBN,0385518927
4794,Tom Peters,Retail Superstars,George Whalin,Inside the 25 Best Independent Stores in America,1591842603,ISBN,1591842603
4795,Tom Peters,Quiet,Susan Cain,The Power of Introverts in a World That Can't Stop Talking,0307352153,ISBN,0307352153
4796,Tom Peters,The Shareholder Value Myth,Lynn Stout,"How Putting Shareholders First Harms Investors, Corporations, and the Public",1605098132,ISBN,1605098132
4797,Tom Peters,The Power of Small,Linda Kaplan Thaler,Why Little Things Make All the Difference,0385526555,ISBN,0385526555
4798,Drew Houston,Poor Charlie's Almanack,Charles T. Munger,The Wit and Wisdom of Charles T. Munger,1578645018,ISBN,1578645018
4799,Drew Houston,Emotional Intelligence,Daniel Goleman,Why It Can Matter More Than IQ,055338371X,ISBN,055338371X
4800,Drew Houston,Zen and the Art of Motorcycle Maintenance,Robert M. Pirsig,An Inquiry Into Values,0060839872,ISBN,0060839872
4801,Drew Houston,Guerilla Marketing,Jay Conrad Levinson,Easy and Inexpensive Strategies for Making Big Profits from Your Small Business,0618785914,ISBN,0618785914
4802,Drew Houston,The Hard Thing About Hard Things,Ben Horowitz,Building a Business When There Are No Easy Answers,0062273205,ISBN,0062273205
4803,Drew Houston,Crossing the Chasm,Geoffrey A. Moore,Marketing and Selling High-Tech Products to Mainstream Customers,0060517123,ISBN,0060517123
4804,Drew Houston,Principles,Ray Dalio,Life and Work,1501124021,ISBN,1501124021
4805,Drew Houston,High Output Management,Andrew S. Grove,,0679762884,ISBN,0679762884
4806,Drew Houston,The Innovator's Dilemma,Clayton M. Christensen,When New Technologies Cause Great Firms to Fail ,1633691780,ISBN,1633691780
4807,Drew Houston,The Effective Executive,Peter F. Drucker,The Definitive Guide to Getting the Right Things Done,0060833459,ISBN,0060833459
4808,Drew Houston,Getting to Yes,Roger Fisher,Negotiating Agreement Without Giving In,0143118757,ISBN,0143118757
4809,Soman Chainani,His Dark Materials Trilogy,Philip Pullman,The Golden Compass / The Subtle Knife / The Amber Spyglass,B008CMFJEU,ASIN,
4810,Soman Chainani,Cirque du Soleil,John U. Bacon,The Spark - Igniting the Creative Fire that Lives within Us All,0385516517,ISBN,0385516517
4811,Soman Chainani,Garden Cities of To-Morrow,Ebenezer Howard,,140995031X,ISBN,140995031X
4812,Soman Chainani,The Graveyard Book,Neil Gaiman,,0060530944,ISBN,0060530944
4813,Soman Chainani,The Little Mermaid,Hans Christian Andersen,,0615963943,ISBN,0615963943
4814,Soman Chainani,The War of Art,Steven Pressfield,Break Through the Blocks and Win Your Inner Creative Battles,1936891026,ISBN,1936891026
4815,Soman Chainani,The Velvet Rage,Alan Downs,Overcoming the Pain of Growing Up Gay in a Straight Man's World,0738215678,ISBN,0738215678
4816,Soman Chainani,The Neverending Story,Michael Ende,,0140386335,ISBN,0140386335
4817,Soman Chainani,The Hard Facts of the Grimms' Fairy Tales,Maria Tatar,,0691114692,ISBN,0691114692
4818,Soman Chainani,Tao Te Ching,Lao Tzu,,B003SHDM8O,ASIN,
4819,Soman Chainani,Peter Pan,J. M. Barrie,,1978311273,ISBN,1978311273
4820,Soman Chainani,A Little Life,Hanya Yanagihara,,0804172706,ISBN,0804172706
4821,Satya Nadella,Deep Learning,Ian Goodfellow,,0262035618,ISBN,0262035618
4822,Satya Nadella,Mindset,Carol S. Dweck,The New Psychology of Success,0345472322,ISBN,0345472322
4823,Satya Nadella,Nonviolent Communication,Marshall B. Rosenberg,A Language of Life: Life-Changing Tools for Healthy Relationships,189200528X,ISBN,189200528X
4824,Satya Nadella,Forged in Crisis,Nancy Koehn,The Making of Five Courageous Leaders,1501174452,ISBN,1501174452
4825,Satya Nadella,The New Leadership Literacies,Bob Johansen,Thriving in a Future of Extreme Disruption and Distributed Everything,B0722RNFJN,ASIN,
4826,Satya Nadella,The Great Transformation,Karl Polanyi,The Political and Economic Origins of Our Time,080705643X,ISBN,080705643X
4827,Satya Nadella,The Rise and Fall of American Growth,Robert J. Gordon,The U.S. Standard of Living since the Civil War,0691147728,ISBN,0691147728
4828,Satya Nadella,The Great Convergence,Richard Baldwin,Information Technology and the New Globalization,0674237846,ISBN,0674237846
4829,Satya Nadella,Shaping the Future of the Fourth Industrial Revolution,Klaus Schwab,,1984822616,ISBN,1984822616
4830,Satya Nadella,Prosperity,Colin Mayer,Better Business Makes the Greater Good,B07HFFLLDX,ASIN,
4831,Satya Nadella,The Narrow Corridor,Daron Acemoglu,"States, Societies, and the Fate of Liberty",0735224382,ISBN,0735224382
4832,Satya Nadella,The Boys in the Boat,Daniel James Brown,Nine Americans and Their Epic Quest for Gold at the 1936 Berlin Olympics,0143125478,ISBN,0143125478
4833,Charles Poliquin,The Warrior Diet,Ori Hofmekler,"Switch on Your Biological Powerhouse For High Energy, Explosive Strength, and a Leaner, Harder Body",1583942009,ISBN,1583942009
4834,Charles Poliquin,Life 101,Peter McWilliams,Everything We Wish We Had Learned About Life in School -- But Didn't,0931580781,ISBN,0931580781
4835,Charles Poliquin,59 Seconds,Richard Wiseman,Change Your Life in Under a Minute,0307474860,ISBN,0307474860
4836,Charles Poliquin,Dinosaur Training Secrets: Volume I,Brooks D. Kubik,"Exercises, Workouts and Training Programs",B00SEQC50A,ASIN,
4837,Charles Poliquin,Jailhouse Strong,Josh Bryant,,1492755796,ISBN,1492755796
4838,Charles Poliquin,Bad Science,Ben Goldacre,"Quacks, Hacks, and Big Pharma Flacks",000728487X,ISBN,000728487X
4839,Charles Poliquin,The ONE Thing,Gary Keller,The Surprisingly Simple Truth Behind Extraordinary Results,1848549253,ISBN,1848549253
4840,Charles Poliquin,The Checklist Manifesto,Atul Gawande,How to Get Things Right,0312430000,ISBN,0312430000
4841,Charles Poliquin,Dinosaur Training Secrets: Volume II,Brooks D. Kubik,How Strong Are You?,B00V7UJP6C,ASIN,
4842,Charles Poliquin,The 4-Hour Workweek,Tim Ferriss,"Escape 9-5, Live Anywhere, and Join the New Rich",0307465357,ISBN,0307465357
4843,Neville Medhora,How To Make Maximum Money In Minimum Time,Gary C. Halbert,,1500885339,ISBN,1500885339
4844,Neville Medhora,A Manual for Living,Epictetus,,0062511114,ISBN,0062511114
4845,Neville Medhora,How to Get Rich,Felix Dennis,One of the World's Greatest Entrepreneurs Shares His Secrets,B0017SUYY6,ASIN,
4846,Neville Medhora,This is Earl Nightingale,Earl Nightingale,,038508501X,ISBN,038508501X
4847,Neville Medhora,Ogilvy on Advertising,David Ogilvy,,039472903X,ISBN,039472903X
4848,Neville Medhora,Think and Grow Rich,Napoleon Hill,,193787950X,ISBN,193787950X
4849,Neville Medhora,Breakthrough Advertising,Eugene M. Schwartz,,0887232981,ISBN,0887232981
4850,Neville Medhora,Getting Everything You Can Out of All You've Got,Jay Abraham,"21 Ways You Can Out-Think, Out-Perform, and Out-Earn the Competition",B00FO7OCPS,ASIN,
4851,Neville Medhora,The Boron Letters,Gary Halbert,,B00BMWEFR4,ASIN,
4852,Neville Medhora,Save The Cat!,Blake Snyder,The Last Book on Screenwriting You'll Ever Need,1932907009,ISBN,1932907009
4853,Neville Medhora,Advertising Secrets of the Written Word,Joseph Sugarman,The Ultimate Resource on How to Write Powerful Advertising Copy from One of America's Top Copywriters and Mail Order Entrepreneurs,B009R5AH48,ASIN,
4854,Neville Medhora,A Whack on the Side of the Head,Roger von Oech,How You Can Be More Creative,0446404667,ISBN,0446404667
4855,Neil deGrasse Tyson,How to Lie with Statistics,Darrell Huff,,0393310728,ISBN,0393310728
4856,Neil deGrasse Tyson,The System of the World,Isaac Newton,,1512181153,ISBN,1512181153
4857,Neil deGrasse Tyson,The Origin of Species,Charles Darwin,,0451529065,ISBN,0451529065
4858,Neil deGrasse Tyson,Age Of Reason,Thomas Paine,,145656854X,ISBN,145656854X
4859,Neil deGrasse Tyson,The Principia,Isaac Newton,The Authoritative Translation and Guide: Mathematical Principles of Natural Philosophy,0520290887,ISBN,0520290887
4860,Neil deGrasse Tyson,The Wealth of Nations,Adam Smith,,1731703619,ISBN,1731703619
4861,Neil deGrasse Tyson,Holy Bible,-,,1432102400,ISBN,1432102400
4862,Neil deGrasse Tyson,The Art Of War,Sun Tzu,,1599869772,ISBN,1599869772
4863,Neil deGrasse Tyson,The Prince,NiccolÃ² Machiavelli,,0486272745,ISBN,0486272745
4864,Neil deGrasse Tyson,The Great Gatsby,F. Scott Fitzgerald,,0743273567,ISBN,0743273567
4865,Neil deGrasse Tyson,The Almagest,Claudius Ptolemy,Introduction to the Mathematics of the Heavens,1888009438,ISBN,1888009438
4866,Neil deGrasse Tyson,Gulliver's Travels,Jonathan Swift,,0486292738,ISBN,0486292738
4867,Nassim Nicholas Taleb,Zero to One,Peter Thiel,"Notes on Startups, or How to Build the Future",0804139296,ISBN,0804139296
4868,Nassim Nicholas Taleb,Elements of Information Theory,Thomas M. Cover,,0471241954,ISBN,0471241954
