,influencer,title,author,subtitle,id_code,identifier_type,ISBN
0,Barack Obama,Life 3.0,Max Tegmark,Being Human in the Age of Artificial Intelligence,1101970316,ISBN,1101970316
1,Barack Obama,Pachinko,Min Jin Lee,,B01GZY28JA,ASIN,
2,Barack Obama,Men Without Women,Haruki Murakami,Stories (Vintage International),1101974524,ISBN,1101974524
3,Barack Obama,Exhalation,Ted Chiang,Stories,1101947888,ISBN,1101947888
4,Barack Obama,Why Liberalism Failed,Patrick J. Deneen,,0300240023,ISBN,0300240023
5,Barack Obama,A Gentleman in Moscow,Amor Towles,A Novel,0670026190,ISBN,0670026190
6,Barack Obama,Asymmetry,Lisa Halliday,A Novel,1501166786,ISBN,1501166786
7,Barack Obama,How to Do Nothing,Jenny Odell,Resisting the Attention Economy,1612197493,ISBN,1612197493
8,Barack Obama,"Girl, Woman, Other",Bernardine Evaristo,,0241364906,ISBN,0241364906
9,Barack Obama,Factfulness,Hans Rosling,Ten Reasons We're Wrong About the World - and Why Things Are Better Than You Think,1250107814,ISBN,1250107814
10,Barack Obama,Self Reliance,Ralph Waldo Emerson,,1545140855,ISBN,1545140855
11,Barack Obama,All the Light We Cannot See,Anthony Doerr,A Novel,1501173219,ISBN,1501173219
12,Barack Obama,Florida,Lauren Groff,,1594634521,ISBN,1594634521
13,Barack Obama,The Broken Ladder,Keith Payne,"How Inequality Affects the Way We Think, Live, and Die",0143128906,ISBN,0143128906
14,Barack Obama,Things Fall Apart,Chinua Achebe,"African Trilogy, Book 1",B004478AS4,ASIN,
15,Barack Obama,Gilead,Marilynne Robinson,A Novel,031242440X,ISBN,031242440X
16,Barack Obama,Lab Girl,Hope Jahren,,1101873728,ISBN,1101873728
17,Barack Obama,The Sixth Extinction,Elizabeth Kolbert,An Unnatural History,1250062187,ISBN,1250062187
18,Barack Obama,The Return,Hisham Matar,"Fathers, Sons and the Land in Between",0812985087,ISBN,0812985087
19,Barack Obama,Evicted,Matthew Desmond,Poverty and Profit in the American City,0553447459,ISBN,0553447459
20,Barack Obama,Normal People,Sally Rooney,A Novel,B07FS25XTW,ASIN,
21,Barack Obama,Dying,Cory Taylor,A Memoir,1941040705,ISBN,1941040705
22,Barack Obama,Educated,Tara Westover,A Memoir,0525589988,ISBN,0525589988
23,Barack Obama,The World as It Is,Ben Rhodes,A Memoir of the Obama White House,0525509372,ISBN,0525509372
24,Barack Obama,The Moment of Lift,Melinda Gates,How Empowering Women Changes the World,1250313570,ISBN,1250313570
25,Barack Obama,An American Marriage,Tayari Jones,A Novel,1616208686,ISBN,1616208686
26,Barack Obama,American Spy,Lauren Wilkinson,A Novel,0812998952,ISBN,0812998952
27,Barack Obama,The Topeka School,Ben Lerner,A Novel,0374277788,ISBN,0374277788
28,Barack Obama,Tough Love,Susan Rice,My Story of the Things Worth Fighting For,1501189972,ISBN,1501189972
29,Barack Obama,The Shallows,Nicholas Carr,What the Internet Is Doing to Our Brains,0393339750,ISBN,0393339750
30,Barack Obama,Truth Decay,Michael D. Rich,An Initial Exploration of the Diminishing Role of Facts and Analysis in American Public Life,B0798MNSQL,ASIN,
31,Barack Obama,A Grain of Wheat,Ngugi wa Thiong'o,,0143106767,ISBN,0143106767
32,Barack Obama,Basketball,Shea Serrano,"A Collection of Questions Asked, Answered, Illustrated",1419726471,ISBN,1419726471
33,Barack Obama,The Girl on the Train,Paula Hawkins,,1594633665,ISBN,1594633665
34,Barack Obama,How Democracies Die,Steven Levitsky,,B071L5C5HG,ASIN,
35,Barack Obama,The Source of Self-Regard,Toni Morrison,"Selected Essays, Speeches, and Meditations",0525562796,ISBN,0525562796
36,Barack Obama,Abraham Lincoln,Abraham Lincoln,Selected Speeches and Writings,1598530534,ISBN,1598530534
37,Barack Obama,The Education of an Idealist,Samantha Power,A Memoir,0062820699,ISBN,0062820699
38,Barack Obama,The Largesse of the Sea Maiden,Denis Johnson,Stories,0812988655,ISBN,0812988655
39,Barack Obama,Trust Exercise,Susan Choi,A Novel,1250309883,ISBN,1250309883
40,Barack Obama,Seveneves,Neal Stephenson,A Novel,0062334514,ISBN,0062334514
41,Barack Obama,How to Read the Air,Dinaw Mengestu,,0679763880,ISBN,0679763880
42,Barack Obama,Long Walk to Freedom,Nelson Mandela,The Autobiography of Nelson Mandela,0316323543,ISBN,0316323543
43,Barack Obama,"Immigrant, Montana",Amitava Kumar,A Novel,0525436677,ISBN,0525436677
44,Barack Obama,Frederick Douglass,David W. Blight,Prophet of Freedom,1416590323,ISBN,1416590323
45,Barack Obama,Becoming,Michelle Obama,,1524763136,ISBN,1524763136
46,Barack Obama,There There,Tommy Orange,A Novel,0525436146,ISBN,0525436146
47,Barack Obama,Feel Free,Zadie Smith,Essays,014311025X,ISBN,014311025X
48,Barack Obama,Trick Mirror,Jia Tolentino,Reflections on Self-Delusion,0525510540,ISBN,0525510540
49,Barack Obama,The Power,Naomi Alderman,,0316547603,ISBN,0316547603
50,Barack Obama,Washington Black,Esi Edugyan,A Novel,0525563245,ISBN,0525563245
51,Barack Obama,Americanah,Chimamanda Ngozi Adichie,,0307455920,ISBN,0307455920
52,Barack Obama,The Oxford Shakespeare,William Shakespeare,The Complete Works,0199267170,ISBN,0199267170
53,Barack Obama,The Lowland,Jhumpa Lahiri,,0307278263,ISBN,0307278263
54,Barack Obama,H Is for Hawk,Helen Macdonald,,0802124739,ISBN,0802124739
55,Barack Obama,Exit West,Mohsin Hamid,A Novel,0735212201,ISBN,0735212201
56,Barack Obama,Anything Is Possible,Elizabeth Strout,A Novel,0812989414,ISBN,0812989414
57,Barack Obama,The Anarchy,William Dalrymple,"The East India Company, Corporate Violence, and the Pillage of an Empire",1635573955,ISBN,1635573955
58,Barack Obama,The Heartbeat of Wounded Knee,David Treuer,Native America from 1890 to the Present,0399573194,ISBN,0399573194
59,Barack Obama,Moby Dick,Herman Melville,,0486432157,ISBN,0486432157
60,Barack Obama,Song of Solomon,Toni Morrison,,140003342X,ISBN,140003342X
61,Barack Obama,Between the World and Me,Ta-Nehisi Coates,,1925240703,ISBN,1925240703
62,Barack Obama,The Warmth of Other Suns,Isabel Wilkerson,The Epic Story of America's Great Migration,1594485399,ISBN,1594485399
63,Barack Obama,The Age of Surveillance Capitalism,Shoshana Zuboff,The Fight for a Human Future at the New Frontier of Power,B01N2QEZE2,ASIN,
64,Barack Obama,The Sixth Man,Andre Iguodala,A Memoir,0525533982,ISBN,0525533982
65,Barack Obama,A House for Mr. Biswas,V. S. Naipaul,A Novel,0375707166,ISBN,0375707166
66,Barack Obama,The Shadow of Sirius,W.S. Merwin,,1556593104,ISBN,1556593104
67,Barack Obama,Inland,Téa Obreht,A Novel,0812992865,ISBN,0812992865
68,Barack Obama,The Yellow House,Sarah M. Broom,A Memoir (2019 National Book Award Winner),0802125085,ISBN,0802125085
69,Barack Obama,Maid,Stephanie Land,"Hard Work, Low Pay, and a Mother's Will to Survive",0316505099,ISBN,0316505099
70,Barack Obama,Arthur Ashe,Raymond Arsenault,A Life,1439189056,ISBN,1439189056
71,Barack Obama,Holy Bible,-,,1432102400,ISBN,1432102400
72,Barack Obama,Barbarian Days,William Finnegan,A Surfing Life,0143109391,ISBN,0143109391
73,Barack Obama,Janesville,Amy Goldstein,An American Story,1501102265,ISBN,1501102265
74,Barack Obama,Futureface,Alex Wagner,"A Family Mystery, an Epic Quest, and the Secret to Belonging",0812987500,ISBN,0812987500
75,Barack Obama,American Prison,Shane Bauer,A Reporter's Undercover Journey into the Business of Punishment,0735223602,ISBN,0735223602
76,Barack Obama,The Underground Railroad,Colson Whitehead,A Novel,B01A4ATV0A,ASIN,
77,Barack Obama,Wolf Hall,Hilary Mantel,,0312429983,ISBN,0312429983
78,Barack Obama,The Nickel Boys,Colson Whitehead,A Novel,0385537077,ISBN,0385537077
79,Barack Obama,A Different Way to Win,Jim Rooney,Dan Rooney's Story from the Super Bowl to the Rooney Rule,1733404910,ISBN,1733404910
80,Barack Obama,Parting the Waters,Taylor Branch,America in the King Years 1954-63,0671687425,ISBN,0671687425
81,Barack Obama,Coach Wooden and Me,Kareem Abdul-Jabbar,Our 50-Year Friendship On and Off the Court,1455542261,ISBN,1455542261
82,Barack Obama,We Live in Water,Jess Walter,Stories,0061926620,ISBN,0061926620
83,Barack Obama,Lot,Bryan Washington,Stories,0525533672,ISBN,0525533672
84,Barack Obama,Lost Children Archive,Valeria Luiselli,A novel,0525436464,ISBN,0525436464
85,Barack Obama,Five-Carat Soul,James McBride,,0735216703,ISBN,0735216703
86,Barack Obama,The Orphan Master's Son,Adam Johnson,A Novel (Pulitzer Prize for Fiction),0812982622,ISBN,0812982622
87,Barack Obama,Finding My Voice,Valerie Jarrett,My Journey to the West Wing and the Path Forward,0525558136,ISBN,0525558136
88,Barack Obama,Say Nothing,Patrick Radden Keefe,A True Story of Murder and Memory in Northern Ireland,0307279286,ISBN,0307279286
89,Barack Obama,Warlight,Michael Ondaatje,A Novel,0525562966,ISBN,0525562966
90,Barack Obama,The New Geography of Jobs,Enrico Moretti,,0544028058,ISBN,0544028058
91,Barack Obama,Washington,Ron Chernow,A Life,0143119966,ISBN,0143119966
92,Barack Obama,"Sing, Unburied, Sing",Jesmyn Ward,A Novel,1501126075,ISBN,1501126075
93,Barack Obama,Grant,Ron Chernow,,0143110632,ISBN,0143110632
94,Barack Obama,Furious Hours,Casey Cep,"Murder, Fraud and the Last Trial of Harper Lee",1785150731,ISBN,1785150731
95,Barack Obama,Heartland,Sarah Smarsh,A Memoir of Working Hard and Being Broke in the Richest Country on Earth,1501133101,ISBN,1501133101
96,Barack Obama,Solitary,Albert Woodfox,,0802148301,ISBN,0802148301
97,Barack Obama,In the Shadow of Statues,Mitch Landrieu,A White Southerner Confronts History,0525559469,ISBN,0525559469
98,Bill Gates,Army of None,Paul Scharre,Autonomous Weapons and the Future of War,0393608980,ISBN,0393608980
99,Bill Gates,Business Adventures,John Brooks,Twelve Classic Tales from the World of Wall Street,B00L1TPCKW,ASIN,
100,Bill Gates,Educated,Tara Westover,A Memoir,0525589988,ISBN,0525589988
101,Bill Gates,The Checklist Manifesto,Atul Gawande,How to Get Things Right,0312430000,ISBN,0312430000
102,Bill Gates,Why We Sleep,Matthew Walker,Unlocking the Power of Sleep and Dreams,B06ZZ1YGJ5,ASIN,
103,Bill Gates,Enlightenment Now,Steven Pinker,"The Case for Reason, Science, Humanism, and Progress",0525427570,ISBN,0525427570
104,Bill Gates,How Not to Be Wrong,Jordan Ellenberg,The Power of Mathematical Thinking,0143127535,ISBN,0143127535
105,Bill Gates,Principles,Ray Dalio,Life and Work,1501124021,ISBN,1501124021
106,Bill Gates,Moonwalking with Einstein,Joshua Foer,The Art and Science of Remembering Everything,0143120530,ISBN,0143120530
107,Bill Gates,13 Things That Don't Make Sense,Michael Brooks,The Most Baffling Scientific Mysteries of Our Time,B001DOHZ9Q,ASIN,
108,Bill Gates,Life 3.0,Max Tegmark,Being Human in the Age of Artificial Intelligence,1101970316,ISBN,1101970316
109,Bill Gates,Factfulness,Hans Rosling,Ten Reasons We're Wrong About the World - and Why Things Are Better Than You Think,1250107814,ISBN,1250107814
110,Bill Gates,Hyperbole and a Half,Allie Brosh,"Unfortunate Situations, Flawed Coping Mechanisms, Mayhem, and Other Things That Happened",B00BSB2AE4,ASIN,
111,Bill Gates,Sapiens,Yuval Noah Harari,A Brief History of Humankind,0062316117,ISBN,0062316117
112,Bill Gates,Energy,Vaclav Smil,A Beginner's Guide,1786071339,ISBN,1786071339
113,Bill Gates,The Headspace Guide to Meditation and Mindfulness,Andy Puddicombe,How Mindfulness Can Change Your Life in Ten Minutes a Day,1250104904,ISBN,1250104904
114,Bill Gates,Should We Eat Meat?,Vaclav Smil,Evolution and Consequences of Modern Carnivory,1118278720,ISBN,1118278720
115,Bill Gates,The Better Angels of Our Nature,Steven Pinker,Why Violence Has Declined,0143122010,ISBN,0143122010
116,Bill Gates,The Rosie Effect,Graeme Simsion,A Novel,B00L6C313E,ASIN,
117,Bill Gates,Brain Rules,John Medina,"12 Principles for Surviving and Thriving at Work, Home, and School",098326337X,ISBN,098326337X
118,Bill Gates,When Breath Becomes Air,Paul Kalanithi,,081298840X,ISBN,081298840X
119,Bill Gates,Stuff Matters,Mark Miodownik,Exploring the Marvelous Materials That Shape Our Man-Made World,0544483944,ISBN,0544483944
120,Bill Gates,21 Lessons for the 21st Century,Yuval Noah Harari,,0525512179,ISBN,0525512179
121,Bill Gates,The Moment of Lift,Melinda Gates,How Empowering Women Changes the World,1250313570,ISBN,1250313570
122,Bill Gates,Mindset,Carol S. Dweck,The New Psychology of Success,0345472322,ISBN,0345472322
123,Bill Gates,Turtles All the Way Down,John Green,,0525555374,ISBN,0525555374
124,Bill Gates,The Black Swan,Nassim Nicholas Taleb,The Impact of the Highly Improbable,081297381X,ISBN,081297381X
125,Bill Gates,Poor Charlie's Almanack,Charles T. Munger,The Wit and Wisdom of Charles T. Munger,1578645018,ISBN,1578645018
126,Bill Gates,On Immunity,Eula Biss,An Inoculation,1555977200,ISBN,1555977200
127,Bill Gates,The Rational Optimist,Matt Ridley,How Prosperity Evolves,0061452068,ISBN,0061452068
128,Bill Gates,"The Feynman Lectures on Physics, Vol. I",Richard P. Feynman,"Mainly Mechanics, Radiation, and Heat",0465024939,ISBN,0465024939
129,Bill Gates,Blitzscaling,Reid Hoffman,The Lightning-Fast Path to Building Massively Valuable Companies,1524761419,ISBN,1524761419
130,Bill Gates,How Asia Works,Joe Studwell,,0802121322,ISBN,0802121322
131,Bill Gates,The Bottom Billion,Paul Collier,Why the Poorest Countries are Failing and What Can Be Done About It,B000SEIU28,ASIN,
132,Bill Gates,String Theory,David Foster Wallace,David Foster Wallace on Tennis,1598534807,ISBN,1598534807
133,Bill Gates,How to Lie with Statistics,Darrell Huff,,0393310728,ISBN,0393310728
134,Bill Gates,Life Is What You Make It,Peter Buffett,Find Your Own Path to Fulfillment,0307464717,ISBN,0307464717
135,Bill Gates,In FED We Trust,David Wessel,Ben Bernanke's War on the Great Panic,0307459683,ISBN,0307459683
136,Bill Gates,The Magic of Reality,Richard Dawkins,How We Know What's Really True,1451675046,ISBN,1451675046
137,Bill Gates,"Guns, Germs, and Steel",Jared Diamond,The Fates of Human Societies,0393354326,ISBN,0393354326
138,Bill Gates,Billion Dollar Whale,Tom Wright,"The Man Who Fooled Wall Street, Hollywood, and the World",031643650X,ISBN,031643650X
139,Bill Gates,A World-Class Education,Vivien Stewart,Learning from International Models of Excellence and Innovation,B0077D8JN8,ASIN,
140,Bill Gates,Collapse,Jared Diamond,How Societies Choose to Fail or Succeed,B004H0M8EA,ASIN,
141,Bill Gates,"Thinking, Fast and Slow",Daniel Kahneman,,0374533555,ISBN,0374533555
142,Bill Gates,"The Feynman Lectures on Physics, Vol. II",Richard P. Feynman,Mainly Electromagnetism and Matter,B00PSSCSQI,ASIN,
143,Bill Gates,The Gene,Siddhartha Mukherjee,An Intimate History,1476733503,ISBN,1476733503
144,Bill Gates,Deng Xiaoping and the Transformation of China,Ezra F. Vogel,,0674725867,ISBN,0674725867
145,Bill Gates,The Man Who Fed the World,Leon Hesser,,0981848664,ISBN,0981848664
146,Bill Gates,Creating the Twentieth Century,Vaclav Smil,Technical Innovations of 1867-1914 and Their Lasting Impact,B00532P4G0,ASIN,
147,Bill Gates,Energy and Civilization,Vaclav Smil,A History,0262536161,ISBN,0262536161
148,Bill Gates,Sustainable Energy,David JC MacKay,Without the Hot Air,0954452933,ISBN,0954452933
149,Bill Gates,xkcd,Randall Munroe,volume 0,0615314465,ISBN,0615314465
150,Bill Gates,The Rosie Project,Graeme Simsion,A Novel,B00BSBR9N6,ASIN,
151,Bill Gates,The Idealist,Nina Munk,Jeffrey Sachs and the Quest to End Poverty,B00BVJG2LK,ASIN,
152,Bill Gates,The Vital Question,Nick Lane,"Energy, Evolution, and the Origins of Complex Life",0393352978,ISBN,0393352978
153,Bill Gates,The Road to Character,David Brooks,,0812983416,ISBN,0812983416
154,Bill Gates,Measure What Matters,John Doerr,"How Google, Bono, and the Gates Foundation Rock the World with OKRs",B078FZ9SYB,ASIN,
155,Bill Gates,What If?,Randall Munroe,Serious Scientific Answers to Absurd Hypothetical Questions,0544456866,ISBN,0544456866
156,Bill Gates,Growth,Vaclav Smil,From Microorganisms to Megacities,B07XKXFLK3,ASIN,
157,Bill Gates,Seveneves,Neal Stephenson,A Novel,0062334514,ISBN,0062334514
158,Bill Gates,Shoe Dog,Phil Knight,A Memoir by the Creator of Nike,B0176M1A44,ASIN,
159,Bill Gates,SuperFreakonomics,Steven D. Levitt,"Global Cooling, Patriotic Prostitutes, and Why Suicide Bombers Should Buy Life Insurance",0060889586,ISBN,0060889586
160,Bill Gates,The World Is Flat,Thomas L. Friedman,A Brief History of the Twenty-first Century,0312425074,ISBN,0312425074
161,Bill Gates,Origin Story,David Christian,A Big History of Everything,0316392006,ISBN,0316392006
162,Bill Gates,Too Big to Fail,Andrew Ross Sorkin,The Inside Story of How Wall Street and Washington Fought to Save the Financial System--and Themselves,0143118242,ISBN,0143118242
163,Bill Gates,The World Until Yesterday,Jared Diamond,What Can We Learn from Traditional Societies?,0670024813,ISBN,0670024813
164,Bill Gates,The Sixth Extinction,Elizabeth Kolbert,An Unnatural History,1250062187,ISBN,1250062187
165,Bill Gates,The Most Powerful Idea in the World,William Rosen,"A Story of Steam, Industry, and Invention",1400067057,ISBN,1400067057
166,Bill Gates,The Future of Capitalism,Paul Collier,Facing the New Anxieties,B077M9MCVW,ASIN,
167,Bill Gates,The Art of Being Unreasonable,Eli Broad,Lessons in Unconventional Thinking,111817321X,ISBN,111817321X
168,Bill Gates,Brief Interviews with Hideous Men,David Foster Wallace,,0316925195,ISBN,0316925195
169,Bill Gates,Abundance,Peter H. Diamandis,The Future Is Better Than You Think,1451614217,ISBN,1451614217
170,Bill Gates,Where Good Ideas Come From,Steven Johnson,The Natural History of Innovation,1594485380,ISBN,1594485380
171,Bill Gates,The Myth of the Strong Leader,Archie Brown,Political Leadership in the Modern Age,0465027660,ISBN,0465027660
172,Bill Gates,The Cat's Table,Michael Ondaatje,,0307744418,ISBN,0307744418
173,Bill Gates,Tools and Weapons,Brad Smith,The Promise and the Peril of the Digital Age,B07PBQQX67,ASIN,
174,Bill Gates,Why Nations Fail,Daron Acemoglu,"The Origins of Power, Prosperity, and Poverty",0307719227,ISBN,0307719227
175,Bill Gates,Showing Up for Life,Bill Gates Sr.,Thoughts on the Gifts of a Lifetime,0385527020,ISBN,0385527020
176,Bill Gates,Identity,Francis Fukuyama,The Demand for Dignity and the Politics of Resentment,0374129290,ISBN,0374129290
177,Bill Gates,Becoming Steve Jobs,Brent Schlender,The Evolution of a Reckless Upstart into a Visionary Leader,0385347421,ISBN,0385347421
178,Bill Gates,Prepared,Diane Tavenner,What Kids Need for a Fulfilled Life,B07M9HGLB3,ASIN,
179,Bill Gates,Broken Genius,Joel N. Shurkin,"The Rise and Fall of William Shockley, Creator of the Electronic Age",0230551920,ISBN,0230551920
180,Bill Gates,Behind the Beautiful Forevers,Katherine Boo,"Life, Death, and Hope in a Mumbai Undercity",1400067553,ISBN,1400067553
181,Bill Gates,A Separate Peace,John Knowles,,0743253973,ISBN,0743253973
182,Bill Gates,Modernist Cuisine,Nathan Myhrvold,The Art and Science of Cooking,0982761007,ISBN,0982761007
183,Bill Gates,Who's Teaching Your Children?,Vivian Troen,Why the Teacher Crisis Is Worse Than You Think and What Can Be Done About It,0300105207,ISBN,0300105207
184,Bill Gates,Team of Rivals,Doris Kearns Goodwin,The Political Genius of Abraham Lincoln,B000N2HBSO,ASIN,
185,Bill Gates,Outliers,Malcolm Gladwell,The Story of Success,0316017930,ISBN,0316017930
186,Bill Gates,Evicted,Matthew Desmond,Poverty and Profit in the American City,0553447459,ISBN,0553447459
187,Bill Gates,Big History,Cynthia Stokes Brown,From the Big Bang to the Present,1595588485,ISBN,1595588485
188,Bill Gates,Awakening Joy,James Baraz,10 Steps That Will Put You on the Road to Real Happiness,055380703X,ISBN,055380703X
189,Bill Gates,Why America Is Not a New Rome,Vaclav Smil,,0262526859,ISBN,0262526859
190,Bill Gates,Energy Transitions,Vaclav Smil,Global and National Perspectives,144085324X,ISBN,144085324X
191,Bill Gates,Why Don't Students Like School?,Daniel T. Willingham,A Cognitive Scientist Answers Questions About How the Mind Works and What It Means for the Classroom,0470279303,ISBN,0470279303
192,Bill Gates,The Perfect Weapon,David E. Sanger,"War, Sabotage, and Fear in the Cyber Age",0451497899,ISBN,0451497899
193,Bill Gates,The Great Escape,Angus Deaton,"Health, Wealth, and the Origins of Inequality",0691165629,ISBN,0691165629
194,Bill Gates,The Catcher in the Rye,J.D. Salinger,,0316769177,ISBN,0316769177
195,Bill Gates,The Heart,Maylis de Kerangal,A Novel,B011I2MOVG,ASIN,
196,Bill Gates,The Emperor of All Maladies,Siddhartha Mukherjee,A Biography of Cancer,1439170916,ISBN,1439170916
197,Bill Gates,Poor Economics,Abhijit V. Banerjee,A Radical Rethinking of the Way to Fight Global Poverty,1610390938,ISBN,1610390938
198,Bill Gates,"Hot, Flat, and Crowded",Thomas L. Friedman,Why We Need a Green Revolution--and How It Can Renew America,0312428928,ISBN,0312428928
199,Bill Gates,Dad Is Fat,Jim Gaffigan,,038534905X,ISBN,038534905X
200,Bill Gates,Capitalism without Capital,Jonathan Haskel,The Rise of the Intangible Economy,B071P3VGHQ,ASIN,
201,Bill Gates,Value-Added Measures in Education,Douglas N. Harris,What Every Educator Needs to Know,1612500005,ISBN,1612500005
202,Bill Gates,The New Science of Strong Materials,J.E. Gordon,Or Why You Don't Fall through the Floor,0691180989,ISBN,0691180989
203,Bill Gates,The Great Gatsby,F. Scott Fitzgerald,,0743273567,ISBN,0743273567
204,Bill Gates,Leonardo da Vinci,Walter Isaacson,,1501139150,ISBN,1501139150
205,Bill Gates,Why Does College Cost So Much?,Robert B. Archibald,,0190214104,ISBN,0190214104
206,Bill Gates,Unlocking the Gates,Taylor Walsh,How and Why Leading Universities Are Opening Up Access to Their Courses,0691148740,ISBN,0691148740
207,Bill Gates,This Time Is Different,Carmen M. Reinhart,Eight Centuries of Financial Folly,0691142165,ISBN,0691142165
208,Bill Gates,Open,Andre Agassi,An Autobiography,0307388409,ISBN,0307388409
209,Bill Gates,Making the Modern World,Vaclav Smil,Materials and Dematerialization,1119942535,ISBN,1119942535
210,Bill Gates,Beyond Smoke and Mirrors,Douglas S. Massey,Mexican Immigration in an Era of Economic Integration,B015DZ7OL4,ASIN,
211,Bill Gates,A Gentleman in Moscow,Amor Towles,A Novel,0670026190,ISBN,0670026190
212,Bill Gates,Work Hard. Be Nice.,Jay Mathews,How Two Inspired Teachers Created the Most Promising Schools in America,1565125169,ISBN,1565125169
213,Bill Gates,Titan II,David Stumpf,A History of a Cold War Missile Program,1557286019,ISBN,1557286019
214,Bill Gates,These Truths,Jill Lepore,A History of the United States,B07BLKWBYT,ASIN,
215,Bill Gates,The Sympathizer,Viet Thanh Nguyen,A Novel,B00PSSG4MM,ASIN,
216,Bill Gates,The Signal and the Noise,Nate Silver,Why So Many Predictions Fail-but Some Don't,B007V65R54,ASIN,
217,Bill Gates,The Hair of the Dog,Karl Sabbagh,And Other Scientific Surprises,B00GVFWRI6,ASIN,
218,Bill Gates,The Grid,Phillip F. Schewe,A Journey Through the Heart of Our Electrified World,0309455995,ISBN,0309455995
219,Bill Gates,The Bet,Paul Sabin,,B00E64EGZQ,ASIN,
220,Bill Gates,Six Days of the Condor,James Grady,,1504028058,ISBN,1504028058
221,Bill Gates,Prime Movers of Globalization,Vaclav Smil,The History and Impact of Diesel Engines and Gas Turbines,0262014432,ISBN,0262014432
222,Bill Gates,Poor Numbers,Morten Jerven,How We Are Misled by African Development Statistics and What to Do about It,080147860X,ISBN,080147860X
223,Bill Gates,How to Spend $50 Billion to Make the World a Better Place,Bjørn Lomborg,,0521685710,ISBN,0521685710
224,Bill Gates,Hit Refresh,Satya Nadella,The Quest to Rediscover Microsoft's Soul and Imagine a Better Future for Everyone,B01HOT5SQA,ASIN,
225,Bill Gates,Getting Better,Charles Kenny,Why Global Development Is Succeeding--And How We Can Improve the World Even More,046503103X,ISBN,046503103X
226,Bill Gates,For the Love of Physics,Walter Lewin,From the End of the Rainbow to the Edge Of Time - A Journey Through the Wonders of Physics,1439108277,ISBN,1439108277
227,Bill Gates,Everything Happens for a Reason,Kate Bowler,And Other Lies I've Loved,0399592083,ISBN,0399592083
228,Bill Gates,Einstein,Walter Isaacson,His Life and Universe,0743264746,ISBN,0743264746
229,Bill Gates,Change.edu,Andrew S Rosen,Rebooting for the New Talent Economy,1607144417,ISBN,1607144417
230,Bill Gates,World on the Edge,Lester R. Brown,How to Prevent Environmental and Economic Collapse,0393339491,ISBN,0393339491
231,Bill Gates,The Path Between the Seas,David McCullough,"The Creation of the Panama Canal, 1870-1914",0671244094,ISBN,0671244094
232,Bill Gates,The City That Became Safe,Franklin E. Zimring,New York's Lessons for Urban Crime and Its Control,0199844429,ISBN,0199844429
233,Bill Gates,Class Warfare,Steven Brill,Inside the Fight to Fix America's Schools,145161201X,ISBN,145161201X
234,Bill Gates,Academically Adrift,Richard Arum,Limited Learning on College Campuses,0226028550,ISBN,0226028550
235,Bill Gates,Energy Myths and Realities,Vaclav Smil,Bringing Science to the Energy Policy Debate,B004RIOM8C,ASIN,
236,Bill Gates,Only the Paranoid Survive,Andrew S. Grove,How to Exploit the Crisis Points That Challenge Every Company,0385483821,ISBN,0385483821
237,Bill Gates,The Power to Compete,Hiroshi Mikitani,An Economist and an Entrepreneur on Revitalizing Japan in the Global Economy,B00ORQ4F54,ASIN,
238,Bill Gates,The Moon Is a Harsh Mistress,Robert A. Heinlein,,0312863551,ISBN,0312863551
239,Bill Gates,The End of Poverty,Jeffrey D. Sachs,Economic Possibilities for Our Time,0143036580,ISBN,0143036580
240,Bill Gates,Tap Dancing to Work,Carol J. Loomis,"Warren Buffett on Practically Everything, 1966-2013",1591846803,ISBN,1591846803
241,Bill Gates,Stretching the School Dollar,Frederick M. Hess,How Schools and Districts Can Save Money While Serving Students Best,B00ELV5YJQ,ASIN,
242,Bill Gates,Science Business,Gary P. Pisano,"The Promise, the Reality, and the Future of Biotech",1591398401,ISBN,1591398401
243,Bill Gates,Railroader,Howard Green,The Unfiltered Genius and Controversy of Four-Time CEO Hunter Harrison,1989025048,ISBN,1989025048
244,Bill Gates,Presidents of War,Michael Beschloss,"The Epic Story, from 1807 to Modern Times",0307409600,ISBN,0307409600
245,Bill Gates,Energies,Vaclav Smil,An Illustrated Guide to the Biosphere and Civilization,026269235X,ISBN,026269235X
246,Bill Gates,Born a Crime,Trevor Noah,Stories from a South African Childhood,0399588175,ISBN,0399588175
