,influencer,title,author,subtitle,id_code,identifier_type,ISBN
1503,Jordan Peterson,Progress,Johan Norberg,Ten Reasons to Look Forward to the Future,1786070650,ISBN,1786070650
1504,Jordan Peterson,Wuthering Heights,Emily Brontë,,0141439556,ISBN,0141439556
1505,Jordan Peterson,The Archetypes and The Collective Unconscious ,Carl Jung,,0691018332,ISBN,0691018332
1506,Jordan Peterson,Point Counter Point,Aldous Huxley,,1564781313,ISBN,1564781313
1507,Jordan Peterson,Myths Dreams and Mysteries,Mircea Eliade,,0060904445,ISBN,0060904445
1508,Jordan Peterson,Flowers for Algernon,Daniel Keyes,,0156030306,ISBN,0156030306
1509,Jordan Peterson,Awakenings,Oliver Sacks,,0375704051,ISBN,0375704051
1510,Jordan Peterson,The First Circle,Aleksandr Solzhenitsyn,,0060139498,ISBN,0060139498
1511,Jordan Peterson,The Ecological Approach to Visual Perception,James J. Gibson,,0898599598,ISBN,0898599598
1512,Jordan Peterson,Psychology and Religion,Carl Jung,West and East,0691097720,ISBN,0691097720
1513,Jordan Peterson,Brain Architecture,Larry W. Swanson,Understanding the Basic Plan,0195105052,ISBN,0195105052
1514,Jordan Peterson,An Outline of Psycho-Analysis,Sigmund Freud,Complete Psychological Works of Sigmund Freud,0393001512,ISBN,0393001512
1515,Jordan Peterson,A Way of Being,Carl Rogers,,0395755301,ISBN,0395755301
1516,Jordan Peterson,The Big Sleep,Raymond Chandler,A Philip Marlowe Novel,0394758285,ISBN,0394758285
1517,Jordan Peterson,Fear and Loathing in Las Vegas,Hunter S. Thompson,A Savage Journey to the Heart of the American Dream,0679785892,ISBN,0679785892
1518,Jordan Peterson,Cancer Ward,Aleksandr Solzhenitsyn,A Novel,0374511993,ISBN,0374511993
1519,Jordan Peterson,"A History of Religious Ideas, Vol. 1",Mircea Eliade,From the Stone Age to the Eleusinian Mysteries,0226204014,ISBN,0226204014
1520,Jordan Peterson,The Charterhouse of Parma,Stendhal,,0140449663,ISBN,0140449663
1521,Jordan Peterson,Psychology and Alchemy,Carl Jung,,0691018316,ISBN,0691018316
1522,Jordan Peterson,"Little Science, Big Science...and Beyond",Derek J.De Solla Price,,0231049560,ISBN,0231049560
1523,Jordan Peterson,"I, Claudius",Robert Graves,From the Autobiography of Tiberius Claudius,067972477X,ISBN,067972477X
1524,Jordan Peterson,Existence,Rollo May,A New Dimension in Psychiatry and Psychology,0671203142,ISBN,0671203142
1525,Jordan Peterson,Aion,Carl Jung,,0415064767,ISBN,0415064767
1526,Jordan Peterson,Anna Karenina,Leo Tolstoy,,0143035002,ISBN,0143035002
1527,Jordan Peterson,An Anthropologist On Mars,Oliver Sacks,Seven Paradoxical Tales,0679756973,ISBN,0679756973
1528,Jordan Peterson,A Farewell to Arms,Ernest Hemingway,,0243323425,ISBN,0243323425
1529,Jordan Peterson,The Long Goodbye,Raymond Chandler,,0394757688,ISBN,0394757688
1530,Jordan Peterson,Play Dreams & Imitation in Childhood,Jean Piaget,,0393001717,ISBN,0393001717
1531,Jordan Peterson,Lord of the Flies,William Golding,,0143124293,ISBN,0143124293
1532,Jordan Peterson,Fratricides,Nikos Kazantzakis,,0571105068,ISBN,0571105068
1533,Jordan Peterson,For Whom the Bell Tolls,Ernest Hemingway,,0684803356,ISBN,0684803356
1534,Jordan Peterson,On the Genealogy of Morals and Ecce Homo,Friedrich Nietzsche,,0679724621,ISBN,0679724621
1535,Jordan Peterson,"A History of Religious Ideas, Vol. 3",Mircea Eliade,From Muhammad to the Age of Reforms,0226204057,ISBN,0226204057
1536,Jordan Peterson,Symbols of Transformation,Carl Jung,,0691018154,ISBN,0691018154
1537,Jordan Peterson,Sometimes a Great Notion,Ken Kesey,,0140045295,ISBN,0140045295
1538,Jordan Peterson,Earth in Human Hands,David Grinspoon,Shaping Our Planet's Future,1455589128,ISBN,1455589128
1539,Jordan Peterson,Mysterium Coniunctionis,Carl Jung,,0691018162,ISBN,0691018162
1540,Jordan Peterson,One Flew Over the Cuckoo's Nest,Ken Kesey,,0451163966,ISBN,0451163966
1541,Jordan Peterson,"A History of Religious Ideas, Vol. 2",Mircea Eliade,From Gautama Buddha to the Triumph of Christianity,0226204030,ISBN,0226204030
1542,Jordan Peterson,The Gulag Archipelago,Aleksandr Solzhenitsyn,Three Volume,B002Y2OG2A,ASIN,
1543,Jordan Peterson,The Gulag Archipelago,Aleksandr Solzhenitsyn,,1784871516,ISBN,1784871516
1544,Ev Williams,Mating,Norman Rush,A Novel,067973709X,ISBN,067973709X
1545,Ev Williams,The Know-It-All,A.J. Jacobs,One Man's Humble Quest to Become the Smartest Person in the World,0743250621,ISBN,0743250621
1546,Ev Williams,Mastery,George Leonard,The Keys to Success and Long-Term Fulfillment,0452267560,ISBN,0452267560
1547,Ev Williams,Antifragile,Nassim Nicholas Taleb,Things That Gain from Disorder,0812979680,ISBN,0812979680
1548,Ev Williams,Why Most Things Fail,Paul Ormerod,"Evolution, Extinction and Economics",0470089199,ISBN,0470089199
1549,Ev Williams,"Thinking, Fast and Slow",Daniel Kahneman,,0374533555,ISBN,0374533555
1550,Ev Williams,Hackers & Painters,Paul Graham,Big Ideas from the Computer Age,1449389554,ISBN,1449389554
1551,Ev Williams,"Surely You're Joking, Mr. Feynman!",Richard P. Feynman,Adventures of a Curious Character,0393355624,ISBN,0393355624
1552,Ev Williams,A Heartbreaking Work of Staggering Genius,Dave Eggers,,0375725784,ISBN,0375725784
1553,Ev Williams,The Cluetrain Manifesto,Rick Levine,,0465024092,ISBN,0465024092
1554,Ev Williams,Snow Crash,Neal Stephenson,A Novel,0553380958,ISBN,0553380958
1555,Ev Williams,Slack,Tom DeMarco,"Getting Past Burnout, Busywork, and the Myth of Total Efficiency",B004SOVC2Y,ASIN,
1556,Ev Williams,Smart and Gets Things Done,Avram Joel Spolsky,Joel Spolsky's Concise Guide to Finding the Best Technical Talent,1590598385,ISBN,1590598385
1557,Ev Williams,Fuzzy Thinking,Bart Kosko,The New Science of Fuzzy Logic,1562828398,ISBN,1562828398
1558,Ev Williams,Everything Bad is Good for You,Steven Johnson,How Today's Popular Culture is Actually Making Us Smarter,1594481946,ISBN,1594481946
1559,Ev Williams,Gates,Stephen Manes,How Microsoft's Mogul Reinvented an Industry--and Made Himself the Richest Man in America,0671880748,ISBN,0671880748
1560,Ev Williams,Dune,Frank Herbert,,0441172717,ISBN,0441172717
1561,Ev Williams,Getting Things Done,David Allen,The Art of Stress-Free Productivity,0143126563,ISBN,0143126563
1562,Ev Williams,The Wisdom of Crowds,James Surowiecki,,0349116059,ISBN,0349116059
1563,Ev Williams,Revolutionary Wealth,Alvin Toffler,,B000QCQ9XE,ASIN,
1564,Ev Williams,Dancing Naked in the Mind Field,Kary Mullis,,0679774009,ISBN,0679774009
1565,Ev Williams,Mind Wide Open,Steven Johnson,Your Brain and the Neuroscience of Everyday Life,0743241665,ISBN,0743241665
1566,Ev Williams,Microserfs,Douglas Coupland,A Novel,B004W2YZ0I,ASIN,
1567,Ev Williams,The Effective Executive,Peter F. Drucker,The Definitive Guide to Getting the Right Things Done,0060833459,ISBN,0060833459
1568,Ev Williams,Wool,Hugh Howey,,B0071XO8RA,ASIN,
1569,Ev Williams,Wired,Gary Wolf,A Romance,B000QCS8XS,ASIN,
1570,Ev Williams,The Power Of One,Bryce Courtenay,,B006ONZUO8,ASIN,
1571,Ev Williams,Small Pieces Loosely Joined,David Weinberger,A Unified Theory Of The Web,B009G1T1OK,ASIN,
1572,Ev Williams,Out Of Control,Kevin Kelly,"The New Biology Of Machines, Social Systems, And The Economic World",B00ADOFLZM,ASIN,
1573,Ev Williams,Man's Search for Meaning,Viktor E. Frankl,,0807014273,ISBN,0807014273
1574,Ev Williams,Focus,Al Ries,The Future of Your Company Depends on It,0887307647,ISBN,0887307647
1575,Ev Williams,Atlas Shrugged,Ayn Rand,,0452011876,ISBN,0452011876
1576,Ev Williams,Positioning,Al Ries,The Battle for Your Mind,B006B7LQ90,ASIN,
1577,Ev Williams,Hackers,Steven Levy,Heroes of the Computer Revolution,B003PDMKIY,ASIN,
1578,Ev Williams,Einstein's Dreams,Alan Lightman,,140007780X,ISBN,140007780X
1579,Ev Williams,Don't Make Me Think,Steve Krug,A Common Sense Approach to Web Usability ,0321965515,ISBN,0321965515
1580,Ev Williams,Mindset,Carol S. Dweck,The New Psychology of Success,0345472322,ISBN,0345472322
1581,Ev Williams,Mindfulness for Beginners,Jon Kabat-Zinn,Reclaiming the Present Moment and Your Life,1622036670,ISBN,1622036670
1582,Ev Williams,Jonathan Livingston Seagull,Richard Bach,,817223578X,ISBN,817223578X
1583,Ev Williams,What Should I Do with My Life?,Po Bronson,The True Story of People Who Answered the Ultimate Question,B000FBFMKC,ASIN,
1584,Ev Williams,The Tipping Point,Malcolm Gladwell,How Little Things Can Make a Big Difference,0316346624,ISBN,0316346624
1585,Ev Williams,The Social Life of Information,John Seely Brown,,1633692418,ISBN,1633692418
1586,Ev Williams,The Pragmatic Programmer,Andrew Hunt,From Journeyman to Master,020161622X,ISBN,020161622X
1587,Ev Williams,The Long Tail,Chris Anderson,Why the Future of Business Is Selling Less of More,B000JMKSE2,ASIN,
1588,Ev Williams,The Fountainhead,Ayn Rand,,0141188626,ISBN,0141188626
1589,Ev Williams,Built to Last,Jim Collins,Successful Habits of Visionary Companies,0060516402,ISBN,0060516402
1590,Ev Williams,You Shall Know Our Velocity,Dave Eggers,,1400033543,ISBN,1400033543
1591,Ev Williams,Understanding Comics,Scott McCloud,The Invisible Art,006097625X,ISBN,006097625X
1592,Ev Williams,Travels,Michael Crichton,,B007UH4H6Y,ASIN,
1593,Ev Williams,"The Way of Life, According to Laotzu",Witter Bynner,,0399512985,ISBN,0399512985
1594,Ev Williams,The Selfish Gene,Richard Dawkins,,0198788606,ISBN,0198788606
1595,Ev Williams,The Echo Maker,Richard Powers,,0312426437,ISBN,0312426437
1596,Ev Williams,Tesla,Margaret Cheney,Man Out of Time,0743215362,ISBN,0743215362
1597,Ev Williams,Losing My Virginity,Richard Branson,"How I've Survived, Had Fun, and Made a Fortune Doing Business My Way",B000SEGJ44,ASIN,
1598,Ev Williams,Bit Literacy,Mark Hurst,Productivity in the Age of Information and E-mail Overload,B001CLFPMY,ASIN,
1599,Ev Williams,Airframe,Michael Crichton,,B000FC1GHO,ASIN,
1600,Ev Williams,Absurdistan,Gary Shteyngart,A Novel,B000GCFWAU,ASIN,
1601,Ev Williams,A Whole New Mind,Daniel Pink,Why Right-Brainers Will Rule the Future,B000PC0SPU,ASIN,
1602,Ev Williams,User Interface Design for Programmers,Joel Spolsky,,1893115941,ISBN,1893115941
1603,Ev Williams,The Perfect Store,Adam Cohen,Inside eBay,B001MYJ3VA,ASIN,
1604,Ev Williams,The Monk and the Riddle,Randy Komisar,The Art of Creating a Life While Making a Living,1578516447,ISBN,1578516447
1605,Ev Williams,The Innovator's Dilemma,Clayton M. Christensen,When New Technologies Cause Great Firms to Fail ,1633691780,ISBN,1633691780
1606,Ev Williams,The Dip,Seth Godin,A Little Book That Teaches You When to Quit (and When to Stick),1591841666,ISBN,1591841666
1607,Ev Williams,The China Study,T. Colin Campbell,"The Most Comprehensive Study of Nutrition Ever Conducted and the Startling Implications for Diet, Weight Loss, and Long-Term Health",1941631568,ISBN,1941631568
1608,Ev Williams,Stumbling on Happiness,Daniel Todd Gilbert,,1400077427,ISBN,1400077427
1609,Ev Williams,Me Talk Pretty One Day,David Sedaris,,0316777722,ISBN,0316777722
1610,Ev Williams,Joel on Software,Joel Spolsky,"And on Diverse and Occasionally Related Matters That Will Prove of Interest to Software Developers, Designers, and Managers, and to Those Who, Whether by Good Fortune or Ill Luck, Work with Them in Some Capacity",1590593898,ISBN,1590593898
1611,Ev Williams,Get Back in the Box,Douglas Rushkoff,How Being Great at What You Do Is Great for Business,0060758708,ISBN,0060758708
1612,Ev Williams,Ender's Game,Orson Scott Card,,0312853238,ISBN,0312853238
1613,Ev Williams,Cat's Cradle,Kurt Vonnegut,A Novel,038533348X,ISBN,038533348X
1614,Ev Williams,Xenocide,Orson Scott Card,Ender Quintet Book 3,B003H4I41S,ASIN,
1615,Ev Williams,The Unbearable Lightness of Being,Milan Kundera,A Novel,0061148520,ISBN,0061148520
1616,Ev Williams,The Starfish and the Spider,Ori Brafman,The Unstoppable Power of Leaderless Organizations,1591841437,ISBN,1591841437
1617,Ev Williams,The First American,H. W. Brands,The Life and Times of Benjamin Franklin,B003M68TI4,ASIN,
1618,Ev Williams,The Bonfire of the Vanities,Tom Wolfe,A Novel,B003GYEGNO,ASIN,
1619,Ev Williams,The Art of the Start,Guy Kawasaki,"The Time-Tested, Battle-Hardened Guide for Anyone Starting Anything",1591840562,ISBN,1591840562
1620,Ev Williams,Sphere,Michael Crichton,,B007UH4G9C,ASIN,
1621,Ev Williams,Speaker for the Dead,Orson Scott Card,Ender Quintet Book 2,B003H4I4JU,ASIN,
1622,Ev Williams,Ready for Anything,David Allen,52 Productivity Principles for Getting Things Done,B000OIZUP8,ASIN,
1623,Ev Williams,On the Road,Jack Kerouac,,0142437255,ISBN,0142437255
1624,Ev Williams,On Intelligence,Jeff Hawkins,How a New Understanding of the Brain Will Lead to the Creation of Truly Intelligent Machines,0805078533,ISBN,0805078533
1625,Ev Williams,Nonzero,Robert Wright,The Logic of Human Destiny,0679758941,ISBN,0679758941
1626,Ev Williams,Lolita,Vladimir Nabokov,,0679723161,ISBN,0679723161
1627,Ev Williams,In the Beginning...Was the Command Line,Neal Stephenson,,B0011GA08E,ASIN,
1628,Ev Williams,Good to Great,Jim Collins,Why Some Companies Make the Leap...And Others Don't,0066620996,ISBN,0066620996
1629,Ev Williams,Fooled by Randomness,Nassim Nicholas Taleb,The Hidden Role of Chance in Life and in the Markets,0812975219,ISBN,0812975219
1630,Ev Williams,Facts and Fallacies of Software Engineering,Robert L. Glass,,0321117425,ISBN,0321117425
1631,Ev Williams,Crossing the Chasm,Geoffrey A. Moore,Marketing and Selling High-Tech Products to Mainstream Customers,0060517123,ISBN,0060517123
1632,Ev Williams,"Alexander and the Terrible, Horrible, No Good, Very Bad Day",Judith Viorst,,0689711735,ISBN,0689711735
1633,Ev Williams,In Search of Excellence,Tom Peters,Lessons from America's Best-Run Companies,0060548789,ISBN,0060548789
1634,Ev Williams,Zen and the Art of Motorcycle Maintenance,Robert M. Pirsig,An Inquiry Into Values,0060839872,ISBN,0060839872
1635,Ev Williams,Reinventing Fire,Amory Lovins,Bold Business Solutions for the New Energy Era,1603583718,ISBN,1603583718
1636,Ev Williams,The Making of a Manager,Julie Zhuo,What to Do When Everyone Looks to You,0735219567,ISBN,0735219567
1637,Ev Williams,Winning,Jack Welch,The Ultimate Business How-To Book,B000FCK3GO,ASIN,
1638,Ev Williams,The World Without Us,Alan Weisman,,0312427905,ISBN,0312427905
1639,Ev Williams,The Victorian Internet,Tom Standage,The Remarkable Story of the Telegraph and the Nineteenth Century's On-Line Pioneers,0802713424,ISBN,0802713424
1640,Ev Williams,The Halo Effect,Phil Rosenzweig,... and the Eight Other Business Delusions That Deceive Managers,0743291255,ISBN,0743291255
1641,Ev Williams,The Great Gatsby,F. Scott Fitzgerald,,0743273567,ISBN,0743273567
1642,Ev Williams,The Diamond Age,Neal Stephenson,"Or, a Young Lady's Illustrated Primer",0553380966,ISBN,0553380966
1643,Ev Williams,The Da Vinci Code,Dan Brown,,0307474275,ISBN,0307474275
1644,Ev Williams,The Curious Incident of the Dog in the Night-Time,Mark Haddon,,1400032717,ISBN,1400032717
1645,Ev Williams,The Corrections,Jonathan Franzen,A Novel,B0022VV0RC,ASIN,
1646,Ev Williams,The Catcher in the Rye,J.D. Salinger,,0316769177,ISBN,0316769177
1647,Ev Williams,The Blind Side,Michael Lewis,Evolution of a Game,0393330478,ISBN,0393330478
1648,Ev Williams,The Black Swan,Nassim Nicholas Taleb,The Impact of the Highly Improbable,081297381X,ISBN,081297381X
1649,Ev Williams,The Amazing Adventures of Kavalier & Clay,Michael Chabon,,B0070O5F4U,ASIN,
1650,Ev Williams,The 4-Hour Workweek,Tim Ferriss,"Escape 9-5, Live Anywhere, and Join the New Rich",0307465357,ISBN,0307465357
1651,Ev Williams,Shopgirl,Steve Martin,A Novella,B000FA5QFO,ASIN,
1652,Ev Williams,Seeing What's Next,Clayton M. Christensen,Using the Theories of Innovation to Predict Industry Change,B004OC06ZO,ASIN,
1653,Ev Williams,Ogilvy on Advertising,David Ogilvy,,039472903X,ISBN,039472903X
1654,Ev Williams,Moneyball,Michael Lewis,The Art of Winning an Unfair Game,0393324818,ISBN,0393324818
1655,Ev Williams,Made to Stick,Chip Heath,Why Some Ideas Survive and Others Die,1400064287,ISBN,1400064287
1656,Ev Williams,Lord of the Flies,William Golding,,0143124293,ISBN,0143124293
1657,Ev Williams,Jitterbug Perfume,Tom Robbins,A Novel,0553348981,ISBN,0553348981
1658,Ev Williams,Jimmy Corrigan,Chris Ware,The Smartest Kid on Earth,0375404538,ISBN,0375404538
1659,Ev Williams,It's Not About the Bike,Lance Armstrong,My Journey Back to Life,0425179613,ISBN,0425179613
1660,Ev Williams,Interface Culture,Steven A. Johnson,How New Technology Transforms the Way We Create & Communicate,0465036805,ISBN,0465036805
1661,Ev Williams,Freakonomics,Steven D. Levitt,A Rogue Economist Explores the Hidden Side of Everything,0060731338,ISBN,0060731338
1662,Ev Williams,Founders at Work,Jessica Livingston,Stories of Startups' Early Days,1430210788,ISBN,1430210788
1663,Ev Williams,Fierce Invalids Home From Hot Climates,Tom Robbins,A Novel,B000FC2OJI,ASIN,
1664,Ev Williams,Emergence,Steven Johnson,"The Connected Lives of Ants, Brains, Cities, and Software",0684868768,ISBN,0684868768
1665,Ev Williams,Cumulus,Eliot Peper,,1532707193,ISBN,1532707193
1666,Ev Williams,Cryptonomicon,Neal Stephenson,,0380788624,ISBN,0380788624
1667,Ev Williams,Blink,Malcolm Gladwell,The Power of Thinking Without Thinking,0316010669,ISBN,0316010669
1668,Ev Williams,Bill & Dave,Michael S. Malone,How Hewlett and Packard Built the World's Greatest Company,1591841526,ISBN,1591841526
1669,Ev Williams,Anthem,Ayn Rand,,1503250709,ISBN,1503250709
1670,Ev Williams,Adverbs,Daniel Handler,A Novel,B000VYX8O0,ASIN,
1671,Ev Williams,The Martian,Andy Weir,A Novel,0553418025,ISBN,0553418025
1672,Jocko Willink,Panzram,Thomas E. Gaddis,A Journal of Murder,1878923145,ISBN,1878923145
1673,Jocko Willink,"How to be Strong, Healthy and Happy",Bob Hoffman,,1467930253,ISBN,1467930253
1674,Jocko Willink,About Face,Colonel David H. Hackworth,The Odyssey of an American Warrior,0671695347,ISBN,0671695347
1675,Jocko Willink,Man's Search for Meaning,Viktor E. Frankl,,0807014273,ISBN,0807014273
1676,Jocko Willink,Mind Over Muscle,Jigoro Kano,Writings from the Founder of Judo,1568364970,ISBN,1568364970
1677,Jocko Willink,The Book of Five Rings,Miyamoto Musashi,,1935785974,ISBN,1935785974
1678,Jocko Willink,Psychology For The Fighting Man,Committee Of The National Research Counc,What You Should Know About Yourself And Others,1162945060,ISBN,1162945060
1679,Jocko Willink,12 Rules for Life,Jordan Peterson,An Antidote to Chaos,0345816021,ISBN,0345816021
1680,Jocko Willink,Hard-Core,Harley Flanagan,Life of My Own,1627310339,ISBN,1627310339
1681,Jocko Willink,The Road,Cormac McCarthy,,0307387895,ISBN,0307387895
1682,Jocko Willink,Serve to Lead,Winston Churchill,The British Army's Anthology on Leadership,1908041021,ISBN,1908041021
1683,Jocko Willink,Tools of Titans,Tim Ferriss,"The Tactics, Routines, and Habits of Billionaires, Icons, and World-Class Performers",1328683788,ISBN,1328683788
1684,Jocko Willink,The Gulag Archipelago,Aleksandr Solzhenitsyn,,1784871516,ISBN,1784871516
1685,Jocko Willink,Musashi,Eiji Yoshikawa,An Epic Novel of the Samurai Era,4770018134,ISBN,4770018134
1686,Jocko Willink,I Said No!,Kimberly King,A Kid-to-kid Guide to Keeping Private Parts Private,1878076493,ISBN,1878076493
1687,Jocko Willink,Blood Meridian,Cormac McCarthy,Or the Evening Redness in the West,0679728759,ISBN,0679728759
1688,Jocko Willink,Wooden Leg,Thomas B. Marquis,A Warrior Who Fought Custer,0803282885,ISBN,0803282885
1689,Jocko Willink,The Killing Zone,Frederick Downs Jr.,My Life in the Vietnam War,0393310892,ISBN,0393310892
1690,Jocko Willink,Valleys of Death,Bill Richardson,A Memoir of the Korean War,0425236730,ISBN,0425236730
1691,Jocko Willink,Forgotten Highlander,Alistair Urquhart,An Incredible WWII Story of Survival in the Pacific,1616084073,ISBN,1616084073
1692,Jocko Willink,The Terminal List,Jack Carr,A Thriller,B074ZL7LY1,ASIN,
1693,Jocko Willink,Tribe of Mentors,Tim Ferriss,Short Life Advice from the Best in the World,B071KJ7PTB,ASIN,
1694,Jocko Willink,Machete Season,Jean Hatzfeld,The Killers in Rwanda Speak,0312425031,ISBN,0312425031
1695,Jocko Willink,Unit 731 Testimony,Hal Gold,Japan's Wartime Human Experimentation Program,0804835659,ISBN,0804835659
1696,Jocko Willink,The Trident,Jason Redman,The Forging and Reforging of a Navy SEAL Leader,0062208322,ISBN,0062208322
1697,Jocko Willink,Steel My Soldiers' Hearts,Col. David H. Hackworth,"The Hopeless to Hardcore Transformation of U.S. Army, 4th Battalion, 39th Infantry, Vietnam",0743246136,ISBN,0743246136
1698,Jocko Willink,The Hundred Rules of War,Tsukahara Bokuden,,1548035661,ISBN,1548035661
1699,Jocko Willink,18 Platoon,Jary,,1901655016,ISBN,1901655016
1700,Jocko Willink,Outlaw Platoon,Sean Parnell,"Heroes, Renegades, Infidels, and the Brotherhood of War in Afghanistan",0062066404,ISBN,0062066404
1701,Jocko Willink,Maps of Meaning,Jordan Peterson,The Architecture of Belief,0415922224,ISBN,0415922224
1702,Jocko Willink,The Rape of Nanking,Iris Chang,The Forgotten Holocaust of World War II,0465068367,ISBN,0465068367
1703,Jocko Willink,True Believer,Jack Carr,A Thriller,1501180843,ISBN,1501180843
1704,Jocko Willink,The Woman Who Could Not Forget,Ying-Ying Chang,Iris Chang Before and Beyond The Rape of Nanking,1605983578,ISBN,1605983578
1705,Jocko Willink,Man of War,Sean Parnell,An Eric Steele Novel,0062668781,ISBN,0062668781
1706,Jocko Willink,Tough As They Come,Travis Mills,,1101904801,ISBN,1101904801
1707,Jocko Willink,Storm of Steel,Ernst Jünger,,0142437905,ISBN,0142437905
1708,Jocko Willink,Fortunate Son,Lewis B. Puller Jr.,The Healing of a Vietnam Vet,0802136907,ISBN,0802136907
1709,Jocko Willink,The Eleventh Day,Anthony Summers,The Full Story of 9/11,0812978099,ISBN,0812978099
1710,Jocko Willink,Ordinary Men,Christopher R. Browning,Reserve Police Battalion 101 and the Final Solution in Poland,0060995068,ISBN,0060995068
1711,Jocko Willink,Unit 731 - Laboratory of the Devil,Yan-jun Yang,Auschwitz of the East,1781556784,ISBN,1781556784
1712,Jocko Willink,A Soldier's Journal,James Bollich,,0806245077,ISBN,0806245077
1713,Jocko Willink,Excursion to Hell,Vincent Bramley,Mount Longdon : A Universal Story of Battle,B00YDK5QUW,ASIN,
1714,Jocko Willink,Battle Studies,Ardant du Picq,Ancient and Modern Battle,1628451173,ISBN,1628451173
1715,Jocko Willink,Into the Fire,Dakota Meyer,A Firsthand Account of the Most Extraordinary Battle in the Afghan War,0812983610,ISBN,0812983610
1716,Jocko Willink,The Art Of War,Sun Tzu,,1599869772,ISBN,1599869772
1717,Jocko Willink,Beyond Band of Brothers,Dick Winters,The War Memoirs of Major Dick Winters,0425213757,ISBN,0425213757
1718,Jocko Willink,Stalingrad,Joachim Wieder,Memories of Hell,B00F2W2DDI,ASIN,
1719,Jocko Willink,Instructions for His Generals,Frederick the Great,,0486444031,ISBN,0486444031
1720,Jocko Willink,Hal Moore on Leadership,Harold G. Moore,Winning when Outgunned and Outmanned,1548305103,ISBN,1548305103
1721,Jocko Willink,Unflinching,Jody Mitic,The Making of a Canadian Sniper,1476795118,ISBN,1476795118
1722,Jocko Willink,On Guerrilla Warfare,Mao Tse-Tung,,956310014X,ISBN,956310014X
1723,Jocko Willink,SOG Chronicles,John Stryker Meyer,Volume One,0983256780,ISBN,0983256780
1724,Jocko Willink,Nothing to Envy,Barbara Demick,Ordinary Lives in North Korea,0385523912,ISBN,0385523912
1725,Jocko Willink,Through the Valley,William Reeder Jr.,My Captivity in Vietnam,1591145864,ISBN,1591145864
1726,Jocko Willink,The Knock at the Door,Ryan Manion,Three Gold Star Families Bonded by Grief and Purpose,1546085238,ISBN,1546085238
1727,Jocko Willink,We Were Soldiers Once . . . and Young,Harold G. Moore,Ia DrangThe Battle That Changed the War in Vietnam,B009S33I68,ASIN,
1728,Jocko Willink,One Soldier's War,Arkady Babchenko,,0802144039,ISBN,0802144039
1729,Jocko Willink,Navy SEAL Dogs,Mike Ritland,My Tale of Training Canines for Combat,1250049695,ISBN,1250049695
1730,Jocko Willink,De Re Militari,Flavius Vegetius Renatus,The Classic Treatise on Warfare at the Pinnacle of the Roman Empire's Power,0857068210,ISBN,0857068210
1731,Jocko Willink,With the Old Breed,E. B. Sledge,At Peleliu and Okinawa,0891419063,ISBN,0891419063
1732,Jocko Willink,The Clay Pigeons of St. Lo,Joseph Balkoski,,0811717828,ISBN,0811717828
1733,Jocko Willink,I Heard My Country Calling,James Webb,A Memoir,B00GPOYEN4,ASIN,
1734,Jocko Willink,Four Hours in My Lai,Michael Bilton,,0140177094,ISBN,0140177094
1735,Jocko Willink,Everyday Heroes,Jody Mitic,Inspirational Stories from Men and Women in the Canadian Armed Forces,150116807X,ISBN,150116807X
1736,Jocko Willink,The Nightingale's Song,Robert Timberg,,0684826739,ISBN,0684826739
1737,Jocko Willink,"Red Blood, Black Sand",Chuck Tatum,Fighting Alongside John Basilone from Boot Camp to Iwo Jima,0425257428,ISBN,0425257428
1738,Jocko Willink,The Coldest War,James Brady,,0312265115,ISBN,0312265115
1739,Jocko Willink,I'm No Hero,Charlie Plumb,A POW Story as Told to Glen DeWerff,0937539384,ISBN,0937539384
1740,Jocko Willink,Fields of Fire,James Webb,A Novel,0553583859,ISBN,0553583859
1741,Jocko Willink,All Out War,Sean Parnell,A Novel,0062668811,ISBN,0062668811
1742,Jocko Willink,Trident K9 Warriors,Mike Ritland,My Tale from the Training Ground to the Battlefield with Elite Navy SEAL Canines,1250073057,ISBN,1250073057
1743,Jocko Willink,The Glory of the Trenches,Coningsby Dawson,An Interpretation,B01K33OV4Y,ASIN,
1744,Jocko Willink,The Armed Forces Officer,U.S. Department of Defense,Edition of 1950,098836963X,ISBN,098836963X
1745,Jocko Willink,Team Dog,Mike Ritland,How to Train Your Dog--the Navy SEAL Way,0425276279,ISBN,0425276279
1746,Jocko Willink,Marine!,Burke Davis,The Life of Chesty Puller,0553271822,ISBN,0553271822
1747,Jocko Willink,Heart for the Fight,Brian Stann,A Marine Hero's Journey from the Battlefields of Iraq to Mixed Martial Arts Champion,076033899X,ISBN,076033899X
1748,Jocko Willink,He Was No Coward,Janet Booth,The Harry Farr Story,1973170876,ISBN,1973170876
1749,Jocko Willink,Reveries on the Art of War,Maurice de Saxe,,0486461505,ISBN,0486461505
1750,Jocko Willink,Conversations with Major Dick Winters,Cole C. Kingseed,Life Lessons from the Commander of the Band of Brothers,0425271544,ISBN,0425271544
